Title,Author,Subjects,First Publish Year,Edition Count,ISBN
Headlines,Caitlin Crews,,2012.0,2.0,
Simpson's Christmas Book,Matt Jones,,2018.0,2.0,
Poems That Touch the Heart,Unknown,,,1.0,
Moll Flanders,Daniel Defoe,,1722.0,565.0,
Instant Astrology,"Felix Lyle, Bryan Aspland",,1998.0,2.0,
Best Loved Poems to Read Again and Again: The Most Moving Verses in the English Language,Not Found,Not Found,,,
Fearless #1,"Janet Evanovich, Lorelei King",,2008.0,13.0,
Modern Man in Search of a Soul (Harvest Book),Carl Gustav Jung,,1955.0,1.0,
Poems of Love,Ovid,,1929.0,14.0,
Out of Her Mind: Women Writing on Madness (Modern Library),Not Found,Not Found,,,
The Bird Artist,Howard Norman,,1994.0,2.0,
Ralph Eugene Meatyard: An American Visionary,Not Found,Not Found,,,
Njals Saga (Classics S.),Not Found,Not Found,,,
Egil's Saga (Classics S.),Not Found,Not Found,,,
The Best of Edward Abbey,Edward Abbey,,1988.0,3.0,
The Island of Lost Maps: A True Story of Cartographic Crime,Not Found,Not Found,,,
Unto the Sons,Gay Talese,,1992.0,6.0,
Shadow Warriors: Inside the Special Forces,Not Found,Not Found,,,
A Graveyard for Lunatics: Another Tale of Two Cities,Not Found,Not Found,,,
November of the Heart,LaVyrle Spencer,,1993.0,9.0,
P Is for Peril (Kinsey Millhone Mysteries (Hardcover)),Not Found,Not Found,,,
Seven Up (A Stephanie Plum Novel),Not Found,Not Found,,,
On the Street Where You Live : A Novel,Not Found,Not Found,,,
All I Desire,Rosemary Rogers,,1999.0,1.0,
Chesapeake Blue,Nora Roberts,,2002.0,33.0,
Mourn Not Your Dead,Deborah Crombie,,1996.0,8.0,
Dreaming of the Bones,Deborah Crombie,,1997.0,6.0,
Firestorm (Anna Pigeon Mysteries (Paperback)),Not Found,Not Found,,,
Blind Descent: : An Anna Pigeon Mystery (Anna Pigeon Mysteries (Paperback)),Not Found,Not Found,,,
YOU BELONG TO ME,Johanna Lindsey,,1994.0,4.0,
"Life Strategies: Doing What Works, Doing What Matters",Phillip C. McGraw,,1999.0,1.0,
"Tap, Tap",Walt Whitman,,1865.0,106.0,
The Weight of Water : A Novel Tag: Author of Resistance and Strange Fits of Passion,Not Found,Not Found,,,
Long Lost,Harlan Coben,,2009.0,17.0,
The HIDDEN LIFE OF DOGS,Elizabeth Marshall Thomas,,1993.0,9.0,
The Tao of Teaching: The Special Meaning of the Tao Te Ching As Related to the Art and Pleasures of Teaching,Not Found,Not Found,,,
No Way Back,Andrew Gross,,2013.0,6.0,
The Oath: A Novel,Not Found,Not Found,,,
River god,Wilbur Smith,,1993.0,29.0,
Recessional,Rudyard Kipling,,1890.0,26.0,
Hearts in Atlantis,Stephen King,,1998.0,55.0,
Total Health Makeover,Marilu Henner,,1999.0,2.0,
Gone for Good,Harlan Coben,,2002.0,23.0,
Unlimited Power,"Anthony Robbins, Robbins, Anthony., Tony Robbins",,1986.0,24.0,
FIRST THINGS FIRST,"Stephen R. Covey, A. Roger Merrill, Rebecca R. Merrill",,1994.0,30.0,
Time Management for Unmanageable People,Ann McGee-Cooper,,1983.0,2.0,
Consultation: A Handbook for Individual and Organization Development,Not Found,Not Found,,,
God on a Harley: A Spiritual Fable,Not Found,Not Found,,,
Obstruction of Justice,Perri O'Shaughnessy,,1997.0,7.0,
Total Control,David Baldacci,,1996.0,48.0,
Deep Lie,Stuart Woods,,1986.0,14.0,
Suspicion of Vengeance,Barbara Parker,,2014.0,4.0,
Invasion of Privacy,Perri O'Shaughnessy,,1996.0,17.0,
Dark Inheritance,Roberta Leigh,,1978.0,1.0,
Jacob Have I Loved,Katherine Paterson,,1980.0,38.0,
Midsummer Bride,Amanda Forester,,2013.0,4.0,
"Time of the Twins Legends 1 (Dragonlance Legends Trilogy, Vol 1)",Not Found,Not Found,,,
You Have Yourself a Deal,James Hadley Chase,,1966.0,6.0,
Family Way,Jayne Ann Krentz,,1987.0,11.0,
Sarah'S Child,Linda Howard,,1985.0,10.0,
Stalker: A Peter Decker and Rina Lazarus Novel,Not Found,Not Found,,,
Dust to Dust,Tami Hoag,,2000.0,13.0,
Grave Secrets (Temperance Brennan Novel (Hardcover)),Kathy Reichs,,2002.0,2.0,
The Broken Hearts Club (Conrad Voort Novels (Paperback)),Not Found,Not Found,,,
Ring of Truth,Jane Corrie,,1975.0,1.0,
Exit to Eden,"Anne Rice, Anne Rampling",,1985.0,18.0,
Killing the Shadows (St. Martin's Minotaur Mysteries),Not Found,Not Found,,,
"The Fine Art Of Erotic Talk : How To Entice, Excite, And Enchant Your Lover With Words",Not Found,Not Found,,,
A Man to Die for,Eileen Dreyer,,1991.0,6.0,
Night over Water,"Ken Follett, K. Follett",,1981.0,56.0,
Body of Evidence,Patricia Cornwell,,1991.0,9.0,
Over the Edge,Laurence Bergreen,,2003.0,20.0,
Anything Considered,Peter Mayle,,1996.0,5.0,
Shades of Earl Grey (A Tea Shop Mystery),Laura Childs,,2003.0,2.0,
The Torso in the Town (Fethering Mysteries (Paperback)),Not Found,Not Found,,,
The Takeover,Liz Fielding,,2002.0,2.0,
The Main Corpse,Diane Mott Davidson,,1996.0,6.0,
Miss Zukas Shelves the Evidence (Miss Zukas Mysteries),Not Found,Not Found,,,
To Engineer Is Human: The Role of Failure in Successful Design,Not Found,Not Found,,,
"Engaged to Die : A Death on Demand Mystery (Hart, Carolyn G)",Not Found,Not Found,,,
Sticks &amp; Scones,"Chip Heath, Dan Heath",,2007.0,7.0,
Miss Zukas and the Stroke of Death (Miss Zukas Mysteries),Jo Dereske,,2006.0,1.0,
Good Harbor: A Novel,Not Found,Not Found,,,
Gone with the Wind,Margaret Mitchell,,1905.0,243.0,
Agatha Raisin and the Quiche of Death (Agatha Raisin Mysteries (Paperback)),Not Found,Not Found,,,
Agatha Raisin and the Vicious Vet (Agatha Raisin Mysteries (Paperback)),Not Found,Not Found,,,
Why America's Children Can't Think: Creating Independent Minds for the 21st Century,Not Found,Not Found,,,
The Awakening,Kate Chopin,,1899.0,346.0,
The Bridge of San Luis Rey (Perennial Classics),Not Found,Not Found,,,
Standoff,Sandra Brown,,2000.0,34.0,
Widow's Walk (Spenser Mysteries (Hardcover)),Not Found,Not Found,,,
Life on the Other Side: A Psychic's Tour of the Afterlife,"Sylvia Browne, Lindsay Harrison",,2001.0,1.0,
What Was Good About Today,Carol Kruckeberg,,1984.0,1.0,
Thunderhead,Neal Shusterman,,2018.0,5.0,
The Killing Kind,M. William Phelps,,2014.0,4.0,
"Dracula Doesn't Rock and Roll (Adventures of the Bailey School Kids, 39)",Not Found,Not Found,,,
"Gremlins Don't Chew Bubble Gum (The Bailey School Kids, Book 13)",Not Found,Not Found,,,
The Red Badge of Courage,Stephen Crane,,1855.0,638.0,
The Canadians (Making of America),Lee D. Willoughby,,1983.0,1.0,
Strange True Stories of Louisiana,George Washington Cable,,1999.0,33.0,
Crooked,Agatha Christie,,1949.0,108.0,
Oscar Otter (I Can Read Book 1),Not Found,Not Found,,,
The Light Fantastic (Discworld Novels (Paperback)),Not Found,Not Found,,,
Spook,"Sam Greenlee, Sam Greenlee, Natiki Hope Pressley",,1969.0,14.0,
Feet of Clay (Discworld Novels (Paperback)),Not Found,Not Found,,,
Twilight Eyes,Dean Koontz,,1985.0,25.0,
When Kambia Elaine Flew in from Neptune,Lori Aurelia Williams,,2000.0,4.0,
Visions: 19 Short Stories (Law at Work),Not Found,Not Found,,,
White Hotel,D. M. Thomas,,1981.0,11.0,
Lucias Measure,Angela Malone,,2000.0,2.0,
The Twins,Laura Lee Hope,,1904.0,94.0,
Spin Cycle,Howard Kurtz,,1998.0,5.0,
"Truly, Madly Manhattan",Nora Roberts,,2003.0,7.0,
Kings of Albion,Julian Rathbone,,2000.0,5.0,
The Third Option,Vince Flynn,,2005.0,4.0,
Tigana,Guy Gavriel Kay,,1990.0,14.0,
The Lions of Al-Rassan,Guy Gavriel Kay,,1995.0,15.0,
A Song for Arbonne,Unknown,,,1.0,
"The Summer Tree (The Fionavar Tapestry, Book 1)",Guy Gavriel Kay,,1992.0,1.0,
"The Wandering Fire (The Fionavar Tapestry, Book 2)",Guy Gavriel Kay,,1987.0,2.0,
"The Darkest Road (The Fionavar Tapestry, Book 3)",Guy Gavriel Kay,,1992.0,1.0,
Princess Smartypants,Babette Cole,,1986.0,28.0,
Modern Locomotives: Fully Illustrated Featuring 150 Locomotives and over 300 Photographs and Illustrations,Not Found,Not Found,,,
A Little Secret for Dealing With Teens,Jennie Hernandez Hanks,,2000.0,1.0,
The Wump World,Bill Peet,,1970.0,8.0,
The Man Who Listens to Horses,"Monty Roberts, Monty Roberts",,1996.0,15.0,
Starfarers,Vonda N. McIntyre,,1989.0,5.0,
Until Forever,Johanna Lindsey,,1995.0,2.0,
Keeper of the Heart,Johanna Lindsey,,1887.0,5.0,
Wild Mountain Thyme,Rosamunde Pilcher,,1978.0,35.0,
Lost and Found,Anne E. Schraff,,2002.0,3.0,
Light in Shadow,Jayne Ann Krentz,,2002.0,20.0,
After Glow,Jayne Ann Krentz,,2004.0,1.0,
Lord of My Heart,Jo Beverley,,1992.0,4.0,
Well Pleasured Lady,Christina Dodd,,1997.0,3.0,
Forever and Always,Jenny Han,,2017.0,11.0,
Love a Dark Rider,Shirlee Busbee,,1994.0,2.0,
Angel,Dan Brown,,2000.0,168.0,
The Empty House,Algernon Blackwood,,1906.0,138.0,
Twist of Fate,Charlotte Lamb,,1979.0,6.0,
On a Wild Night (Cynster Novels),Not Found,Not Found,,,
The Devil's Bargain,Robyn Donald,,2002.0,1.0,
Don't Look Back,Lynette Eason,,2010.0,1.0,
The Bride Hunt,Olivia Parker,,2008.0,6.0,
The Target,"James Patterson, Maxine Paetro",,1728.0,28.0,
The Unlikely Angel,Nadine Miller,,1998.0,1.0,
Out of the Shadows (Shadows Trilogy (Paperback)),Not Found,Not Found,,,
Grand Passion,Jayne Ann Krentz,,1994.0,12.0,
Midnight Jewels,Jayne Ann Krentz,,1987.0,9.0,
Hidden Talents,Jayne Ann Krentz,,1993.0,7.0,
Eye of the Beholder,Jayne Ann Krentz,,1999.0,8.0,
Survival of the Fittest: An Alex Delaware Novel,Not Found,Not Found,,,
Acorna's People,"Anne McCaffrey, Elizabeth Ann Scarborough",,1999.0,11.0,
The Twilight Before Christmas,"Christine Feehan, Teri Clark Linden",,2003.0,7.0,
The Bachelor List,Jane Feather,,2004.0,3.0,
Illusions : A Novel,Simon Van,,2013.0,1.0,
North American Indian Life: Customs and Traditions of 23 Tribes,Not Found,Not Found,,,
Woman's Book of Rituals and Celebrations,Not Found,Not Found,,,
The Land of Narnia: Brian Sibley Explores the World of C.S. Lewis,Not Found,Not Found,,,
The Evolution Man or How I Ate My Father,"Lewis, Roy",,1993.0,1.0,
Digger,Terry Pratchett,,1990.0,24.0,
See Jane Run,Hannah Jayne,,2014.0,3.0,
The Puzzle of the Red Stallion,Stuart Palmer,,1936.0,4.0,
Death of an Expert Witness,P. D. James,,2003.0,1.0,
The Cat Who Came for Christmas,Cleveland Amory,,1987.0,12.0,
Munich 10,Elfriede Ledig,,2011.0,3.0,
Search the Shadows,Barbara Michaels,,1987.0,16.0,
Stitches in Time,Andrew J. Robinson,,2000.0,2.0,
Cities of the Dead,"James Patterson, Mindy McGinnis",,2021.0,9.0,
"Welcome to Camp Nightmare (Goosebumps, No 9)",Not Found,Not Found,,,
Muffy's Scrapbook,Barbara Isenberg,,2000.0,1.0,
Fools of Fortune (King Penguin S.),Not Found,Not Found,,,
Prelude to Foundation (Foundation Novels (Paperback)),Not Found,Not Found,,,
Foundation's Edge (Foundation Novels (Paperback)),Not Found,Not Found,,,
Dones (ColÂ¨lecciÃ³ clÃ ssica),Not Found,Not Found,,,
Al Final del Verano,Not Found,Not Found,,,
El Arpista Ciego: Una Fantasia del Reinado de Tutankamon,Unknown,,2002.0,1.0,
One Man Show,Nicolas Fargues,,2002.0,1.0,
Defcon One,Joe Weber,,1817.0,6.0,
The White Plague,J. Harvey,,1908.0,1.0,
Mythology,Edith Hamilton,,1940.0,59.0,
Of Mice and Men (Penguin Great Books of the 20th Century),Not Found,Not Found,,,
Flatland (Shambhala Pocket Classics),Not Found,Not Found,,,
Sense and sensibility,Jane Austen,,1811.0,2015.0,
Sleeping Beauty and Other Fairy Tales (Dover Children's Thrift Classics),Not Found,Not Found,,,
Sacred Geometry (Wooden Books),Miranda Lundy,,2001.0,1.0,
Colorado (Photographic Tour Series),Not Found,Not Found,,,
The Little Mermaid and Other Fairy Tales (Dover's Children's Thrift Classics),Not Found,Not Found,,,
Pride and Prejudice (Puffin Classics),Not Found,Not Found,,,
Through the Looking-Glass: And What Alice Found There (Dover Thrift Editions),Not Found,Not Found,,,
The Deep End of the Ocean,Jacquelyn Mitchard,,1996.0,10.0,
A Stranger in the Mirror,Sidney Sheldon,,1976.0,17.0,
House On Olive Street,Robyn Carr,,1999.0,17.0,
B Is for Burglar (Kinsey Millhone Mysteries (Paperback)),Not Found,Not Found,,,
C Is for Corpse (Kinsey Millhone Mysteries (Paperback)),Not Found,Not Found,,,
What Dreams May Come : A Novel,Not Found,Not Found,,,
Gerald's Game,Stephen King,,1992.0,56.0,
FORREST GUMP (Movie Tie in),Winston Groom,,1994.0,1.0,
Rose Madder,Stephen King,,1995.0,56.0,
"Eckankar: Ancient Wisdom for Today: How Past Lives, Dreams, and Soul Travel Help You Find God",Not Found,Not Found,,,
Body of a Crime,Michael C. Eberhardt,,1994.0,5.0,
Bird's-Eye View,Cecil Roth,,1935.0,13.0,
Schindler's list,Thomas Keneally,,1982.0,15.0,
Watching the Wind: Conflict Resolution During South Africa's Transition to Democracy,Not Found,Not Found,,,
Muhammad: His Life Based on the Earliest Sources,Faisal Fahim,,2014.0,1.0,
Needlepoint designs from Amish quilts,Barbara Bucholtz,,1980.0,1.0,
Sherlock Holmes Encyclopedia,Unknown,,1984.0,1.0,
Captain's Verses (New Directions Paperbook),Not Found,Not Found,,,
The Book of Nightmares,Galway Kinnell,,1971.0,3.0,
Murder for profit,William Bolitho,,1926.0,8.0,
James Herriots Dog Stories,James Herriot,,1986.0,3.0,
Hamlet (Bantam Classics),Not Found,Not Found,,,
Eaters of the Dead,Michael Crichton,,1976.0,49.0,
Small leather journal with strap-myra series,Anatolian Treasures,,1999.0,2.0,
Tidings of Great Joy,Sandra Brown,,1987.0,9.0,
Night Flying,Frances Hardinge,,2006.0,2.0,
Neither Here nor There: Travels in Europe,Not Found,Not Found,,,
"Pride and Prejudice (The Penguin English Library, El 72)",Not Found,Not Found,,,
Emergency Doctor,Edward Ziegler,,1987.0,5.0,
The Voyage (Hammer Universe),David Drake,,1995.0,1.0,
Winner's Guide To Texas Hold'em Poker,Ken Warren,,1996.0,1.0,
The 1998 What Color Is Your Parachute : A Practical Manual for Job-Hunters and Career Changers (Paper),Not Found,Not Found,,,
Forge of the Elders,L. Neil Smith,,2000.0,2.0,
Twilight of the Empire,Simon R. Green,,1997.0,1.0,
Blue Moon Rising (Hawk &amp; Fisher),Simon R. Green,,2000.0,1.0,
Deathstalker: Being the First Part of the Life and Times of Owen Deathstalker (Owen Deathstalker),Simon R Green,,,1.0,
The LEGACY OF GIRD  (TRADE PAPERBACK),Not Found,Not Found,,,
Neuromancer (Remembering Tomorrow),Not Found,Not Found,,,
Voice of the Blood,Jemiah Jefferson,,2001.0,2.0,
Sister India,Peggy Payne,,2001.0,3.0,
Girls' Poker Night,Jill A. Davis,,2003.0,4.0,
Special Deliverance (del Rey Book),Not Found,Not Found,,,
Tom Clancy's Op-Center (Tom Clancy's Op Center (Paperback)),Not Found,Not Found,,,
Wolf's Hour,"Coates, John, John Coates",,2012.0,9.0,
Does My Bum Look Big in This?,Arabella Weir,,1999.0,1.0,
All Quiet West Frnt 1,Not Found,Not Found,,,
The Nightingale Gallery,Paul Doherty,,2021.0,2.0,
Naked Came the Manatee,"Carl Hiaasen, Dave Barry, Hall, James W., Edna Buchanan, Elmore Leonard, Les Standiford, Levine, Paul, Brian Antoni, Tananarive Due, John Dufresne, Vicki Hendricks, Carolina Hospital, Evelyn Wilde Mayerson",,1995.0,8.0,
The Crown of Columbus,"Louise Erdrich, Michael Dorris",,1987.0,8.0,
Animal Talk: Interspecies Telepathic Communications,Not Found,Not Found,,,
The Portable Henry Rollins,Henry Rollins,,1997.0,2.0,
Books of Blood: Volumes One to Three,Not Found,Not Found,,,
"Comets (Issac Asimov's Wonderful World of Science Fiction, No 4)",Not Found,Not Found,,,
Never Count Out the Dead (St. Martin's Minotaur Mysteries),Boston Teran,,2002.0,1.0,
Oceano Mare,Alessandro Baricco,,1993.0,23.0,
First Test (Protector of the Small),Tamora Pierce,,1999.0,13.0,
In the Hand of the Goddess (Song of the Lioness (Paperback)),Not Found,Not Found,,,
"When Hope Springs New (Canadian West, Book 4)",Not Found,Not Found,,,
Lucy's Treasure,G. E. Dabbs,,2003.0,2.0,
My Antonia: And Related Readings (Literature Connections),Not Found,Not Found,,,
Beautiful Bodies : A Novel,Not Found,Not Found,,,
No Choice but Surrender,Meagan McKinney,,1987.0,1.0,
The Pony Wife,Beverly Bird,,1995.0,1.0,
Irish Gold (Nuala Anne McGrail Novels),Andrew M. Greeley,,,1.0,
Seed Catalogue,Thos. W. Emerson Co,,1904.0,10.0,
A Potion for a Widow (Chronicles of Isaac of Girona),Not Found,Not Found,,,
Private Indiscretions,Susan Crosby,,2004.0,1.0,
"Pillow Talk (Harlequin Temptation, No. 967)",Not Found,Not Found,,,
Slightly Single (Red Dress Ink (Paperback)),Wendy Markham,,2002.0,1.0,
Back Bay,Bainbridge Bunting,,1967.0,6.0,
Home to You (Harlequin American Romance),Not Found,Not Found,,,
The Wedding is White (Silhouette Desire),Not Found,Not Found,,,
One's Company: Reflections on Living Alone,Not Found,Not Found,,,
"Ordinary Grace: An Examination of the Roots of Compassion, Altruism, and Empathy, and the Ordinary Individuals Who Help Others in Extraordinary Ways",Not Found,Not Found,,,
TENDER IS THE NIGHT,F. Scott Fitzgerald,,1933.0,312.0,
Persuasion: With a Memoir of Jane Austen,Unknown,,1967.0,1.0,
When the Bough Breaks (Alex Delaware Novels (Paperback)),Not Found,Not Found,,,
Ariana,Rachel Ann Nunes,,1998.0,8.0,
Intensive Care,Philip Woodrow,,2002.0,16.0,
CORELLI'S MANDOLIN : A Novel,Not Found,Not Found,,,
The Long Walk: The True Story of a Trek to Freedom,Slavomir Rawicz,,2016.0,1.0,
Bunnicula: A Rabbit-Tale of Mystery,Not Found,Not Found,,,
The Littles (Littles),"Laura Ingalls Wilder, Garth Williams, Laura Ingalls Wilder, Laura Ingalls Laura Ingalls Wilder",,1932.0,113.0,
The Coffin Dancer (Lincoln Rhyme Novels (Paperback)),Not Found,Not Found,,,
"As Time Goes by (California Series, Book 2)",Not Found,Not Found,,,
"Sean Donovan (The Californians, Bk 3)",Not Found,Not Found,,,
"A Promise for Tomorrow (Ribbons of Steel, 3)",Not Found,Not Found,,,
"A Hope Beyond (Ribbons of Steel, 2)",Not Found,Not Found,,,
"Distant Dreams (Ribbons of Steel, 1)",Not Found,Not Found,,,
"Whatever Tomorrow Brings (The Californians, Bk. 1)",Not Found,Not Found,,,
"Donovan's Daughter (The Californians, Book 4)",Lori Wick,,2007.0,1.0,
"Sisters of the Confederacy (Secret Refuge, 2)",Not Found,Not Found,,,
"Daughter of Twin Oaks (Secret Refuge, 1)",Lauraine Snelling,,2000.0,1.0,
The Amethyst Heart,Penelope J. Stokes,,2000.0,3.0,
The Amber Photograph,Penelope J. Stokes,,2001.0,5.0,
The Memory Book : A Novel,Not Found,Not Found,,,
The Treasure Box,Penelope J. Stokes,,2001.0,6.0,
"Are You Lonesome Tonight? (Harlequin Temptation, No. 958)",Not Found,Not Found,,,
Mary Reilly,Valerie Martin,,1990.0,10.0,
Two Old Women,Velma Wallis,,1993.0,14.0,
Vampires Don't Wear Polka Dots (Adventures of the Bailey School Kids (Paperback)),Not Found,Not Found,,,
"Sprite's Secret (Pixie Tricks, 1)",Not Found,Not Found,,,
The Diamond Princess Steps Through the Mirror,Jahnna N. Malcolm,,1999.0,1.0,
Chick Challenge (Animal Ark Pets),Ben M. Baglio,,1999.0,3.0,
"All Chalked Up (Powerpuff Girls Chapter Book, 2)",Not Found,Not Found,,,
"Cartoon Crazy (Powerpuff Girls Chapter Book, 3)",Not Found,Not Found,,,
"What Remains to Be Discovered : Mapping the Secrets of the Universe, the Origins of Life, and the Future of the Human Race",Not Found,Not Found,,,
Ever Since Darwin: Reflections in Natural History,Not Found,Not Found,,,
Reason for Hope : A Spiritual Journey,Not Found,Not Found,,,
"Return to the Chateau: Preceded By, a Girl in Love",Not Found,Not Found,,,
Story of O,Dominique Aury,,1965.0,11.0,
Creek Walk and Other Stories,Molly Giles,,1996.0,2.0,
"Major Barbara: Definitive Text (Shaw, Bernard, Bernard Shaw Library.)",Not Found,Not Found,,,
Pygmalion : A Romance in Five Acts,George Bernard Shaw,,2021.0,1.0,
The Complete Short Stories of Mark Twain (Bantam Classic),Not Found,Not Found,,,
Charlie and the Chocolate Factory (Puffin Novels),Not Found,Not Found,,,
The Te of Piglet,Benjamin Hoff,,1992.0,7.0,
The Crucible: A Play in Four Acts (Twentieth-Century Classics),Not Found,Not Found,,,
Webster's Legal Speller,Unknown,,1978.0,1.0,
A Short History of Canada,Donald Campbell Masters,,1958.0,4.0,
"Twelfth Night, Or, What You Will (Signet Classic Shakespeare Series)",Not Found,Not Found,,,
The Outlandish Companion,Diana Gabaldon,,2015.0,2.0,
Blake: Poems (Everyman's Library Pocket Poets),Not Found,Not Found,,,
Animal Farm: A Fairy Story,"Giancarlo Rossini, George Orwell",,2021.0,1.0,
"The Birthright (Song of Acadia, 3)","Janette Oke, T. Davis Bunn",,2000.0,9.0,
Pippi in the South Seas,Astrid Lindgren,,2020.0,1.0,
The Princess and Curdie (Puffin Classics),Not Found,Not Found,,,
The Princess and the Goblin (Puffin Classics - the Essential Collection),Not Found,Not Found,,,
"A Searching Heart (Prairie Legacy, No. 2)",Not Found,Not Found,,,
Beyond the Gathering Storm (Canadian West (Unnumberd)),Not Found,Not Found,,,
When Tomorrow Comes (Canadian West (Unnumberd)),Not Found,Not Found,,,
"The Sacred Shore (Song of Acadia, 2)","Janette Oke, T. Davis Bunn",,2000.0,7.0,
"The Meeting Place (Song of Acadia, 1)","Janette Oke, T. Davis Bunn",,1999.0,6.0,
Drums of Autumn,"Diana Gabaldon, Geraldine James",,1997.0,15.0,
"Like Gold Refined (Prairie Legacy, 4)",Not Found,Not Found,,,
"A Quiet Strength (Oke, Janette, Prairie Legacy, 3)",Not Found,Not Found,,,
Voyager,C.S. Lewis,,1952.0,100.0,
Canadian Poetry (New Press Canadian Classics),Not Found,Not Found,,,
The Tender Years (Prairie Legacy),Not Found,Not Found,,,
Don Quixote,"Miguel de Cervantes Saavedra, Michael J. Marshall, John Ormsby, Anonymous",,1600.0,1587.0,
Making It Happen: Reflections on Leadership,Not Found,Not Found,,,
Dan Leno Limehouse Golem Cook Pro,Not Found,Not Found,,,
The Trial,James Dashner,,2010.0,13.0,
Easy Silence,Angela Huth,,2001.0,3.0,
Resurrecting Salvador,Jeremy Dronfield,,1999.0,2.0,
Room for a Single Lady,Clare Boylan,,1997.0,1.0,
Tinker Tailor Soldier Spy,John le Carré,,1974.0,23.0,
Vernon God Little: A 21st Century Comedy in the Presence of Death,Not Found,Not Found,,,
"Beyond Jennifer &amp; Jason, Madison &amp; Montana : What To Name Your Baby Now","Linda Rosenkrantz, Pamela Redmond Satran",,1999.0,5.0,
E-Tales: The Best &amp; Worst of Internet Humor,Unknown,,1967.0,1.0,
Mothers &amp; Others for a Livable Planet Guide to Natural Baby Care : Nontoxic and Environmentally Friendly Ways to Take Care of Your New Child,Beverly Cleary,,1979.0,48.0,
New Woman,The Federation of Feminist Women's Health Centers,,1981.0,1.0,
Room,Edward Morgan Forster,,1908.0,180.0,
The Body Project: An Intimate History of American Girls,Not Found,Not Found,,,
The New Whole Foods Encyclopedia: A Comprehensive Resource for Healthy Eating,Not Found,Not Found,,,
LAPP,Robert Paine,,1900.0,7.0,
Microsklaven.,Douglas Coupland,,1996.0,4.0,
PIONEER WOMEN,E. F. Ellet,,1852.0,13.0,
La lenteur: Roman,Not Found,Not Found,,,
I Haven't Understood Anything Since 1962,Lewis Grizzard,,1993.0,1.0,
"One True Love? (Harlequin Flipside, No. 2)",Not Found,Not Found,,,
"Who Needs Decaf? (Harlequin Flipside, No. 6)",Not Found,Not Found,,,
Slightly Settled (Red Dress Ink),Not Found,Not Found,,,
Bet Me,Jennifer Crusie,,2004.0,6.0,
ACROSS THE BORDER: TRUE STORY OF SATANIC CULT KILLINGS,Not Found,Not Found,,,
Marrying the Mistress,Joanna Trollope,,2000.0,9.0,
The Nanny Diaries,"Emma McLaughlin, Emma Mclaughlin, Nicola Kraus",,2002.0,11.0,
The Stone Diaries,Carol Shields,,1993.0,65.0,
The Big Girls' Guide to Life: A Plus-Sized Jaunt Through a Body-Obsessed World,Not Found,Not Found,,,
Winter Prey,John Sandford,,1993.0,7.0,
A Collection of Beauties at the Height of Their Popularity: A Novel,Not Found,Not Found,,,
Gravity : A Novel of Medical Suspense,Not Found,Not Found,,,
Gates of Hell,Earl David,,2015.0,1.0,
Up &amp; Out (Red Dress Ink),"Booker T. Washington, James L. Robinson, Tom Basham, B. Washington",,1900.0,321.0,
Elegance : A Novel,Harriet Marlow,,2020.0,1.0,
Midnight Come Again (Kate Shugak Mysteries (Hardcover)),Not Found,Not Found,,,
Salem Falls,Jodi Picoult,,2001.0,5.0,
Killing Grounds: A Kate Shugak Mystery (Kate Shugak Mystery/Dana Stabenow),Not Found,Not Found,,,
"Hunter's Moon: A Kate Shugak Mystery (Stabenow, Dana. Kate Shugak Mystery.)",Not Found,Not Found,,,
Picture Perfect,Jodi Picoult,,1995.0,6.0,
Harvesting the Heart,Jodi Picoult,,1993.0,6.0,
Going to Ground: Simple Life on a Georgia Pond,Not Found,Not Found,,,
Just One Look,Harlan Coben,,2001.0,25.0,
Chicken Soup for the Romantic Soul : Inspirational Stories About Love and Romance (Chicken Soup for the Soul (Paperback Health Communications)),Not Found,Not Found,,,
She's Not There : A Life in Two Genders,Not Found,Not Found,,,
Three Wishes,Liane Moriarty,,2004.0,6.0,
Killing for Company: The Story of a Man Addicted to Murder,Not Found,Not Found,,,
Won't You Come Home Billy Bob,Lewis Grizzard,,1980.0,5.0,
WOMEN,Louisa May Alcott,,1848.0,1887.0,
One False Move (Myron Bolitar Mysteries (Paperback)),Not Found,Not Found,,,
Alice Little &amp; the Big Girl's Blouse,Boyd Brent,,2016.0,5.0,
The Summer They Came : A Novel,Not Found,Not Found,,,
The Case of the Secret Password (Clue Jr.),Parker C. Hinter,,1997.0,1.0,
Lizzie McGuire: When Moms Attack! - Book #1 : Junior Novel (Lizzie McGuire (Numbered)),Not Found,Not Found,,,
"Lizzie Goes Wild! (Lizzie McGuire Junior Novel, Book 3)",Not Found,Not Found,,,
"Play Ball, Amelia Bedelia (I Can Read Book 2)",Not Found,Not Found,,,
Amelia Bedelia and the Surprise Shower,Peggy Parish,,1966.0,19.0,
"Dawn's Big Move (Baby-Sitters Club, 67)",Ann M. Martin,,2014.0,1.0,
"Jessica the Thief (Sweet Valley Twins and Friends, No 67)",Not Found,Not Found,,,
Fourth Grade Is a Jinx,Colleen O'Shaughnessy McKenna,,1989.0,2.0,
The Girl With the Silver Eyes,Willo Davis Roberts,,1980.0,6.0,
"Claudia and the Middle School Mystery (Baby-Sitters Club, 40)",Ann M. Martin,,2014.0,1.0,
The Lost Locket (Nancy Drew Notebook 2) : The Lost Locket,Carolyn Keene,,1994.0,2.0,
"Lila on the Loose (Unicorn Club, No 14)",Not Found,Not Found,,,
It's Great to Be Eight,"Roald Dahl, Paula Danziger, Patricia MacLachlan, Patricia McKissack, Margaret Mahy, Ann M. Martin, Phyllis Reynolds Naylor",,1997.0,5.0,
TROUBLE AT CAMP TREEHOUSE (NANCY DREW NOTEBOOK 7) : TROUBLE AT CAMP TREEHOUSE,Carolyn Keene,,1995.0,1.0,
"The Middle School Gets Married (Sweet Valley Twins, No 68)",Not Found,Not Found,,,
"A Curse on Elizabeth (Sweet Valley Kids Hair Raiser Super Special, No 3)",Not Found,Not Found,,,
"Dawn and the School Spirit War (Baby-Sitters Club, 84)",Ann M. Martin,,2015.0,1.0,
"The Amazing Jessica (Sweet Valley Kids, 60)",Not Found,Not Found,,,
Amelia Bedelia's Family Album,"Peggy Parish, Lynn Sweat",,1988.0,14.0,
Twits,Roald Dahl,,1967.0,101.0,
Bxc Woodshed Mystery,Not Found,Not Found,,,
Caboose Mystery (Boxcar Children (Paperback)),Not Found,Not Found,,,
