Title,Author,Subjects,First Publish Year,Edition Count,ISBN
Death in Paradise,Death in Paradise,,2024.0,1.0,
Maybe the moon,Armistead Maupin,,1992.0,15.0,
Les Enfants du marais,Georges Montforez,,1958.0,1.0,
Une si longue nuit,Michèle Laurence,,2006.0,1.0,
Le Petit Prince,Antoine de Saint-Exupéry,,1943.0,371.0,
Ne pleure pas ma belle,Mary Higgins Clark,,1992.0,1.0,
Resurrection Club,Christopher Wallace,,1999.0,4.0,
Queen of Angels,Greg Bear,,1990.0,19.0,
Ernst Luwig Kirchner: Mountain Life: The Early Years in Davos 1917-1926,Not Found,Not Found,,,
"Four Major Plays: A Doll House, the Wild Duck, Hedda Gabler, the Master Builder (Signet Classics (Paperback))",Not Found,Not Found,,,
Sing Me Home,Christine BACKUS,,2018.0,6.0,
Heaven Lake : A Novel,Not Found,Not Found,,,
I Am Legend,Richard Matheson,,1954.0,54.0,
Searching for Virginia Dare: A Fool's Errand,Not Found,Not Found,,,
"Spite, Malice and Revenge: The Complete Guide to Getting Even (3 Diabolical Volumes in 1)",Not Found,Not Found,,,
Internet Firewalls and Network Security,Karanjit Siyan,,1995.0,1.0,
CCNA Exam Certification Guide (CCNA Exam 640-407),Wendell Odom,,1999.0,1.0,
The New York Public Library Science Desk Reference (The New York Public Library Series),Not Found,Not Found,,,
Ethics for the New Millennium,"Chapman, Richard A.",,2000.0,2.0,
Bump and Run,Tabatha Kiss,,2019.0,1.0,
"Little Golden America (Foreign Travelers in America, 1810-1935 Ser.)",Not Found,Not Found,,,
Education of a Felon,Edward Bunker,,2000.0,2.0,
Past Continuous (Tusk Ivories),Yaakov Shabtai,,2002.0,1.0,
Valor's Choice (Daw Book Collectors),Tanya Huff,,2000.0,1.0,
Silberfaden.,Ricarda Junge,,2002.0,1.0,
Dinero Etico,Piergiorgio M. Sandri,,2003.0,1.0,
El Profeta,Kahlil Gibran,,1991.0,6.0,
"Io, non io, neanche lui (Universale economica Feltrinelli)",Not Found,Not Found,,,
Son De Mar,Manuel Vicent,,1999.0,2.0,
Verdilak,Bo Hampton,,1996.0,1.0,
Shella,Andrew Vachss,,1993.0,8.0,
The Sexual Life of Catherine M.,Not Found,Not Found,,,
The Thoughts of an Emigrant,Albert Schwarzenbach,,2004.0,1.0,
"Storm Front (The Dresden Files, Book 1)",Not Found,Not Found,,,
Love medicine: A novel,Not Found,Not Found,,,
Los De Abajo (Letras hispÃ¡nicas),Not Found,Not Found,,,
Los Diez Secretos Del Amor Abundante,Adam J. Jackson,,2001.0,1.0,
Manual de medicina popular Canaria,José Jaén,,1989.0,1.0,
The Spirit Catches You and You Fall Down,Anne Fadiman,,1997.0,6.0,
Vampyres: Lord Byron to Count Dracula,Unknown,,,1.0,
Ten Great Mysteries by Edgar Allan Poe,"Coklin, Groff (editor) Illustrated By Docktor, Irv",,,0.0,
The Bride and the Bachelors: Five Masters of the Avant-Garde,Not Found,Not Found,,,
Drawing on the Right Side of the Brain: A Course in Enhancing Creativity and Artistic Confidence,Not Found,Not Found,,,
PHOENIX FLOWER,J. T. Harper,,2021.0,2.0,
The Jasmine Man,Lola Lemire Tostevin,,2001.0,1.0,
Martha Peake: A Novel of the Revolution,Not Found,Not Found,,,
Margaret the Queen (Coronet Books),Not Found,Not Found,,,
The Dragon and the Djinn,Gordon R. Dickson,,1985.0,6.0,
Winter Solstice,"Rosamunde Pilcher, Jilly Bond",,1957.0,16.0,
Tropical Depression,Laurence Shames,,1996.0,8.0,
"The Playboy's Protegee (Harlequin American Romance, 988)",Not Found,Not Found,,,
Falcon'S Flight,Daphne du Maurier,,1965.0,32.0,
"Night Of The Jaguar (Im Extra, Code Name: Danger) (Silhouette Intimate Moments, No 637)",Not Found,Not Found,,,
"Tempted In Texas (Single In The City) (Harlequin Temptation, No. 864)",Not Found,Not Found,,,
"Playing With Fire (Loveswept, No 792)",Not Found,Not Found,,,
"Man Under The Mistletoe (Harlequin Temptation, No 568)",Not Found,Not Found,,,
"Pride Of St Charles Avenue (Silhouette Special Edition, No 800)",Not Found,Not Found,,,
"Phoenix Rising (Silhouette Special Edition, No. 524)",Not Found,Not Found,,,
Fairy Tale Girl (Western Lovers #8) (Western Lovers : Denim &amp; Diamonds),Ann Major,,1995.0,1.0,
High-Riding Heroes (Kismet Romance),Not Found,Not Found,,,
"Mclain'S Law (Premiere) (Silhouette Intimate Moments, No 528)",Not Found,Not Found,,,
"Lethal Lover (Dangerous Men) (Harlequin Intrigue, No 345)",Not Found,Not Found,,,
"Girl He Left Behind (Harlequin Romance, No 3111)",Not Found,Not Found,,,
Spirit Of Love (Harlequin Presents No. 11545),Not Found,Not Found,,,
"Sand Man (Harlequin American Romance, No. 455)",Not Found,Not Found,,,
The Firebrand,Marion Zimmer Bradley,,1987.0,18.0,
"Angel Of The Knight (Historical, 501)",Diana Hall,,2000.0,1.0,
"Tame An Older Man (2001 Ways To Wed) (Harlequin American Romance, No 871)",Not Found,Not Found,,,
"Daddy To Be Determined (Who'S The Daddy?) (American Romance, 882)",Not Found,Not Found,,,
"Have Cowboy, Need Cupid (Harlequin American Romance, No 979)",Not Found,Not Found,,,
"Secret Service Dad: Grooms in Uniform (Harlequin American Romance, No 947)",Not Found,Not Found,,,
Prime Time,Sandra Brown,,1983.0,21.0,
Tiger Prince,Sandra Brown,,1985.0,11.0,
Where There's Smoke,Sandra Brown,,1993.0,20.0,
Slow Heat in Heaven,Sandra Brown,,1988.0,27.0,
Tomorrow's Promise: Can the Heart Let Go of Yesterday?,Not Found,Not Found,,,
Sunset Embrace,Sandra Brown,,1985.0,17.0,
Sweet Anger,Sandra Brown,,1985.0,18.0,
Eloquent Silence,Sandra Brown,,1982.0,23.0,
Tempest in Eden,Sandra Brown,,1983.0,15.0,
Hidden Fires,Sandra Brown,,1982.0,8.0,
Another Dawn,Sandra Brown,,1985.0,19.0,
"Tapestry Of Fate (Harlequin Historical, No 246)",Not Found,Not Found,,,
Dana and the Calendar Man (Harlequin American Romance #662),Not Found,Not Found,,,
Love Beyond Reason,Sandra Brown,,1981.0,19.0,
"Ghostwriter (Harlequin Intrigue, No 228)",Not Found,Not Found,,,
"Randall Honor  (Brides For Brothers) (Harlequin American Romance, No. 930)",Not Found,Not Found,,,
"Sweeping the Bride Away (Harlequin American Romance, No 963)",Not Found,Not Found,,,
Destiny'S Child,Barbara Bretton,,1995.0,4.0,
Loveswept #44: The Last Brady,Iris Johansen,,1986.0,1.0,
"When Stars Collide (Silhouette Special Edition, No 867)",Not Found,Not Found,,,
For Old Times Sake (Men: Made In America) (Men Made in America),Kathleen Eagle,,1995.0,1.0,
"Step From A Dream (Special Edition, No 658)",Not Found,Not Found,,,
"The Unlawfully Wedded Princess (The Carradignes: American Royalty) (Harlequin American Romance Series, No. 917)",Not Found,Not Found,,,
"The Inconveniently Engaged Prince: The Carradignes-American Royalty (Harlequin American Romance, No 946)",Not Found,Not Found,,,
"One More Time (Harlequin Temptation, No 450)",Not Found,Not Found,,,
"Texas Royalty (Special Edition, 1343)",Not Found,Not Found,,,
"Twilight Magic (Harlequin American Romance, No 16504)",Not Found,Not Found,,,
We Were the Mulvaneys,Joyce Carol Oates,,1996.0,10.0,
Chang and Eng: A Novel,Not Found,Not Found,,,
Palomar,Italo Calvino,,1981.0,29.0,
Ultimate Journey: Retracing the Path of an Ancient Buddhist Monk Who Crossed Asia in Search of Enlightenment (Vintage Departures),Not Found,Not Found,,,
The Rise and  Fall of the American Teenager,Thomas Hine,,1999.0,3.0,
The Gangster of Love,Jessica Tarahata Hagedorn,,1996.0,2.0,
What If Our World Is Their Heaven? The Final Conversations Of Philip  K. Dick,"Tim (Forward) Lee, GWen & Sauter, Doris Elaine (Editors) Powers",,2006.0,1.0,
Animal Rights &amp; Human Morality,Tom Regan,,1983.0,5.0,
Old Jules,Mari Sandoz,,1935.0,13.0,
The Visitor,Katherine Applegate,,1996.0,20.0,
Lucy Breckinridge of Grove Hill,"Lucy Gilmer Breckinridge, Robertson",,1979.0,3.0,
"Heroes and Saints &amp; Other Plays: Giving Up the Ghost, Shadow of a Man, Heroes and Saints",R.J. Unstead,,1974.0,1.0,
A Dooryard Full of Flowers and Other Short Pieces,Unknown,,,1.0,
Laurel,"Paula Fox, Eros Keith",,1973.0,38.0,
The Riverhouse Stories: How Pubah S. Queen and Lazy Larue Saved the World,Not Found,Not Found,,,
Kiss Sleeping Beauty Goodbye: Breaking the Spell of Feminine Myths and Models,Not Found,Not Found,,,
"Coping With Miscarriage: A Simple, Reassuring Guide to Emotional and Physical Healing",Not Found,Not Found,,,
Family in Transition,"Arlene S. Skolnick, Jerome H. Skolnick",,1977.0,10.0,
Gender Gap: Bella Abzug's Guide to Political Power for American Women,Not Found,Not Found,,,
Against Our Will,Susan Brownmiller,,1975.0,17.0,
Women's Reality: An Emerging Female System in a White Male Society,Anne Wilson Schaef,,,1.0,
New Chicana/Chicano Writing 2,Charles M. Tatum,,1992.0,2.0,
New Chicana/Chicano Writing 1,Charles M. Tatum,,1992.0,3.0,
Blood Sugar,Majestical Notebook,,2018.0,99.0,
"Generation Q: Gays, Lesbians, and Bisexuals Born Around 1969's Stonewall Riots Tell Their Stories of Growing Up in the Age of Information",Not Found,Not Found,,,
Lesbian crossroads: Personal stories of lesbian struggles and triumphs,Not Found,Not Found,,,
Circling the Drain : Stories,Not Found,Not Found,,,
Hot Chicken Wings,Jyl Lynn Felman,,1992.0,3.0,
The Floating World,Kazuo Ishiguro,,1986.0,22.0,
The E-Myth Contractor: Why Most Contractors' Businesses Don't Work and What to Do About It,Not Found,Not Found,,,
Wild at Heart: Discovering the Secret of a Man's Soul,John Eldredge,,2011.0,1.0,
"All the Trouble in the World: The Lighter Side of Overpopulation, Famine, Ecological Disaster, Ethnic Hatred, Plague, and Poverty",Unknown,,,1.0,
The Golden Fleece and the heros who lived before achilles,Padraic Colum,,1921.0,54.0,
Der Himmel Ã?Â¼ber dem Moor.,Not Found,Not Found,,,
Bethlehem Road,Anne Perry,,1991.0,4.0,
"Coelln: Stadt, Dom, Fluss.",Not Found,Not Found,,,
"Alles flieÃ?Â?t, sagt Heraklit.",Not Found,Not Found,,,
Boy. SchÃ?Â¶nes und Schreckliches aus meiner Kinderzeit.,Not Found,Not Found,,,
Die Welle,Dennis Gansel,,2008.0,1.0,
The Final Judgment,Richard North Patterson,,1995.0,6.0,
The Dragon and the Unicorn,Lynne Cherry,,1994.0,5.0,
Una Chica Cualquiera (Andanzas),Not Found,Not Found,,,
Malas Artes,Donna Leon,,2003.0,2.0,
Terminal,Michael Crichton,,1972.0,45.0,
Understanding Your Personality,"Patricia Hedges, Patricia H. Hedges",,1993.0,1.0,
A Book Without Covers,John Andrew Storey,,2003.0,1.0,
Irrational Man : A Study in Existential Philosophy,William Barrett,,1962.0,1.0,
True Magick: A Beginner's Guide (Llewellyn's New Age Series),Not Found,Not Found,,,
Garzanti - Gli Elefanti: Creatura Di Sabbia,Not Found,Not Found,,,
Garzanti - Gli Elefanti: Gabbiano Jonathan Livingston,Not Found,Not Found,,,
Wed and Buried (Bed-And-Breakfast Mysteries (Paperback)),Not Found,Not Found,,,
Mazel Tov in Las Vegas. Ein Hochzeitsroman.,Holly-Jane Rahlens,,2000.0,1.0,
Cabal/an Aurelio Zen Mystery,Not Found,Not Found,,,
A Cold Case,Philip Gourevitch,,2001.0,6.0,
A Sangre Fria,J. M. Servín,,2008.0,1.0,
Cujo,Stephen King,,1981.0,80.0,
The Caves of Steel,Isaac Asimov,,1953.0,58.0,
A Clockwork Orange (Norton Paperback Fiction),Not Found,Not Found,,,
Crime and Punishment (Crime &amp; Punishment),"Fyodor Dostoevsky, Constance Black Garnett, Bibliophile Bibliophile Pro",,1866.0,88.0,
Demian: The Story of Emil Sinclair's Youth (Perennial Classics),Not Found,Not Found,,,
Filth,Irvine Welsh,,1996.0,22.0,
Fallen Angels,Walter Dean Myers,,1984.0,16.0,
The Sun Never Sets: Travels to the Remaining Outposts of the British Empire,Not Found,Not Found,,,
Belinda,Anne Rice,,1986.0,8.0,
Intramuros (Los libros de la candamia),Jose Maria Merino,,1998.0,1.0,
Natural Affinities,Erica Funkhouser,,1983.0,1.0,
Dix petits nÃ?Â¨gres,Not Found,Not Found,,,
The Queen of the South,Arturo Pérez-Reverte,,2017.0,1.0,
Budapest : A Novel,Not Found,Not Found,,,
Captains of the Sands,Keith Dewhurst,,1982.0,2.0,
"Sisters: Shared Histories, Lifelong Ties",Not Found,Not Found,,,
Balzac and the Little Chinese Seamstress : A Novel,Not Found,Not Found,,,
Charades,Patricia Wilson,,1996.0,5.0,
Sarajevo!,A. J. P. Taylor,,1966.0,7.0,
Il Circolo Della Fortuna E Della Felicita,Not Found,Not Found,,,
Marrying Mom,"Adams, Kenneth M., Kenneth Adams, Alexander P. Morgan",,2007.0,3.0,
Seta,Alessandro Baricco,,1920.0,53.0,
Menos Tu Vientre,Miguel Hernández,,1997.0,1.0,
Gift from the Sea,Anne Morrow Lindbergh,,1955.0,25.0,
The Tenth Justice,Brad Meltzer,,1997.0,22.0,
The Fig Eater : A Novel,Not Found,Not Found,,,
East of Eden,John Steinbeck,,1952.0,90.0,
Mein Studium ferner Welten: Ein Roman in 14 Geschichten,Alex Capus,,2003.0,2.0,
Settings of Silver: An Introduction to Judaism,Not Found,Not Found,,,
Understanding the Old Testament (Abridged 4th Edition),Not Found,Not Found,,,
Kosher Sex: A Recipe for Passion and Intimacy,Not Found,Not Found,,,
The Scarlet Letter (Penguin Popular Classics),Unknown,,,1.0,
Medea ; Fedra (I Classici della BUR),Not Found,Not Found,,,
Tom Clancy's Op-Center: Divide and Conquer (Tom Clancy's Op Center (Paperback)),Not Found,Not Found,,,
The Murder of Roger Ackroyd,Agatha Christie,,1926.0,205.0,
Siddharta Romanzo Versione Di M Mila,Hermann Hesse,,2003.0,1.0,
"Moby-Dick Or, the Whale (Penguin Classics)",Not Found,Not Found,,,
Nothing but the Truth,Avi,,1991.0,15.0,
The Late Man,Andreas Schroeder,,1972.0,2.0,
Hardcase,Dan Simmons,,2001.0,7.0,
Chaos &amp; Cyber Culture,James Gleick,,1987.0,35.0,
"Earthbridge Crossing: A Sunny Approach to Philosophy, Quantum Physics, Spiritual Awareness, and the Evolution of Human Consciousness ; A Mythological Fantasy Tale",Not Found,Not Found,,,
The Golden Key,George MacDonald,,1906.0,34.0,
My Name Is Red,Orhan Pamuk,,1998.0,1.0,
Juniper Tree Burning : A Novel,Not Found,Not Found,,,
An Equal Music,Vikram Seth,,1999.0,7.0,
Dakota: A Spiritual Geography,Not Found,Not Found,,,
The Distance from the Heart of Things,Ashley Warlick,,1996.0,2.0,
The Mill on the Floss (Oxford World's Classics),Unknown,,,1.0,
A Peculiar Chemistry,Kitty Ray,,1999.0,2.0,
Miss Smilla's Feeling for Snow,Peter Høeg,,1993.0,10.0,
Year of Wonders,Geraldine Brooks,,2001.0,21.0,
Tales of a Female Nomad: Living at Large in the World,Not Found,Not Found,,,
The Select,Charles Darwin,,1859.0,218.0,
AsÃ­ hablÃ³ Zaratustra/ MÃ¡s allÃ¡ del bien y el mal/ El anticristo/El ocaso de los Ã­dolos,Not Found,Not Found,,,
El Alquimista,Paulo Coelho,,2016.0,1.0,
Of Mice and Men,John Steinbeck,,1937.0,193.0,
Goddess of the Sea (Berkley Sensation),Not Found,Not Found,,,
His Eternal Kiss,"Karla Hocker, Judith A. Lansdowne, Jeanne Savery",,2003.0,1.0,
The Star King,Jack Vance,,1964.0,15.0,
The Defiant Hero,Suzanne Brockmann,,2001.0,6.0,
Lord of Fire,Gaelen Foley,,2002.0,7.0,
"Divinely Decadent: Liza Minnelli, the Drugs, the Sex &amp; the Truth Behind Her Bizarre Marriage",Not Found,Not Found,,,
Held Captive : The Kidnapping and Rescue of Elizabeth Smart,Not Found,Not Found,,,
Still Life With Murder (Gilded Age Mysteries (Berkley)),Not Found,Not Found,,,
Top O' the Mournin' : A Passport to Peril Mystery,Not Found,Not Found,,,
Night Embrace (Dark-Hunter),Sherrilyn Kenyon,,2005.0,1.0,
Grime and Punishment (Jane Jeffry Mysteries (Paperback)),Not Found,Not Found,,,
A Greek God at the Ladies' Club (Avon Romance),Not Found,Not Found,,,
A Girl's Guide to Vampires,Katie MacAlister,,2003.0,7.0,
When Darkness Falls,Heather Graham,,2000.0,7.0,
Confucius Lives Next Door: What Living in the East Teaches Us About Living in the West,"Reid, T. R",,,1.0,
Where's My Hero?,"Lisa Kleypas, Julia Quinn, Kinley MacGregor",,2003.0,3.0,
Edge of the Moon (Berkley Sensation),Not Found,Not Found,,,
"Summer Knight (The Dresden Files, Book 4)",Not Found,Not Found,,,
Paperback Writer,Mark Shipper,,1977.0,6.0,
The Search,Robert W. Chambers,,1904.0,198.0,
All I Really Need to Know,Robert Fulghum,,1986.0,17.0,
Running with Scissors: A Memoir,Unknown,,2002.0,1.0,
Making a Killing,Iain McDowall,,2001.0,6.0,
Catcher in the Rye,J. D. Salinger,,1900.0,130.0,
Ethan Frome,Edith Wharton,,1910.0,1000.0,
The Omni-Americans: Some Alternatives to the Folklore of White Supremacy (Da Capo Press Paperback),Not Found,Not Found,,,
Shopaholic Takes Manhattan,Sophie Kinsella,,2002.0,4.0,
Bleak House (Signet Classics (Paperback)),Not Found,Not Found,,,
Tommy's Tale : A Novel,Alan Cumming,,2004.0,1.0,
The Pickup,"Jason D. Lollar, Stephanie Lollar",,1999.0,1.0,
July's People,Nadine Gordimer,,1981.0,15.0,
Maurice,Edward Morgan Forster,,1971.0,54.0,
Hiroshima,John Richard Hersey,,1946.0,26.0,
Hard Times,"Charles Dickens, García de García de Luna, Elisa Esgasa, Emilia Pardo Bazán",,1854.0,1030.0,
Jane Eyre (Penguin Classics),Charlotte Brontë,,2021.0,1.0,
"Harrington Gay Men's Fiction Quarterly, Issue 4",Thomas Long,,2003.0,1.0,
Earthshine: A Novel,Not Found,Not Found,,,
Blue Lawn,"Taylor, William",,1994.0,2.0,
The President's Son: A Novel,Not Found,Not Found,,,
On Yankee Station: The Naval Air War over Vietnam,Not Found,Not Found,,,
The Night Listener : A Novel,Not Found,Not Found,,,
Kids Who Make a Difference,Chandler,,1996.0,1.0,
Sometimes I Dream in Italian,Rita Ciresi,,2000.0,3.0,
The hill,Gilbert Keith Chesterton,,1904.0,206.0,
Hunchback of Notre Dame,Victor Hugo,,1831.0,266.0,
The Front Runner,Patricia Nell Warren,,1974.0,16.0,
"20,000 Leagues Under the Sea (Bantam Classics)",Not Found,Not Found,,,
Soulmates,Christina Lauren,,2021.0,5.0,
The Abyssinian: A Novel,Not Found,Not Found,,,
El Perfume: Historia De UN Asesino,Not Found,Not Found,,,
Star Wars: Shadows of the Empire,Steve Perry,,1996.0,15.0,
Ghost Girl: The True Story of a Child in Peril and the Teacher Who Saved Her,Not Found,Not Found,,,
Complete Sherlock Holmes,Arthur Conan Doyle,,1900.0,119.0,
Works of Edgar Allan Poe,Edgar Allan Poe,,1903.0,50.0,
Dhalgren (Vintage),Not Found,Not Found,,,
A New Song (Mitford Years (Paperback)),Not Found,Not Found,,,
A Long Fatal Love Chase,Louisa May Alcott,,1995.0,1.0,
"Winnie-The-Pooh on Problem Solving: In Which Pooh, Piglet and Friends Explore How to Solve Problems So You Can Too",Not Found,Not Found,,,
E-Mail to the Front: One Wife's Correspondence with Her Husband Overseas,Not Found,Not Found,,,
Tara Road,Anne Edwards,,1983.0,12.0,
The Beatles Lyrics Illustrated,Beatles,,1976.0,1.0,
Final Judgment,Richard North Patterson,,1995.0,6.0,
LADY BOSS,Jackie Collins,,1990.0,20.0,
Le Ore,James Fenimore Cooper,,1800.0,85.0,
Soie,Françoise Sagan,,1975.0,10.0,
Discovering Dixie: The Best of the Deep South Along the Magnolia Trail,Not Found,Not Found,,,
Peace Pilgrim Her Life and Work In Her Own,Peace Pilgrim,,1994.0,1.0,
Miles from Nowhere: A Round the World Bicycle Adventure,Unknown,,,1.0,
The Night Country,Melissa Albert,,2019.0,7.0,
North Carolina : A Guide to Backcountry Travel &amp; Adventure,Not Found,Not Found,,,
"The Tiger in the Well (Sally Lockhart Trilogy, Book 3)",Not Found,Not Found,,,
Travelers' Tales Tuscany: True Stories,Not Found,Not Found,,,
Women of the Pleasure Quarters: The Secret History of the Geisha,Unknown,,,1.0,
Sexing the Cherry (Vintage International),Not Found,Not Found,,,
The Wonders of the Invisible World: Stories,Not Found,Not Found,,,
Silicon Follies,Thomas Scoville,,2001.0,3.0,
"The Hobbit (Young Adult edition, Sis cover)",Not Found,Not Found,,,
Up at the Villa,William Somerset Maugham,,1941.0,15.0,
Greasy Lake and Other Stories (Contemporary American Fiction),Not Found,Not Found,,,
Teeth Week,Nancy Alberts,,1993.0,2.0,
Reading Lolita in Tehran : A Memoir in Books,Not Found,Not Found,,,
Bodysculpture: Weight Training for Women,Not Found,Not Found,,,
To the Lighthouse,Virginia Woolf,,1927.0,520.0,
My Little Blue Dress,Bruno Maddox,,1999.0,7.0,
My Cat Forgets Who Pays the Rent,Sandra Magsamen,,2001.0,1.0,
Our Marvelous Native Tongue,Robert Claiborne,,1983.0,3.0,
"The Little Book of Letting Go: A Revolutionary 30-Day Program to Cleanse Your Mind, Lift Your Spirit and Replenish Your Soul",Not Found,Not Found,,,
The Wind Done Gone: A Novel,Not Found,Not Found,,,
Crisis on Doona,Anne McCaffrey,,1992.0,5.0,
Sword-Dancer (Sword (DAW Fantasy)),Not Found,Not Found,,,
Restoree,Anne McCaffrey,,1967.0,21.0,
Crowned Heads,Thomas Tryon,,1976.0,5.0,
Facial Justice (Twentieth Century Classics),L.P. Hartley,,1987.0,1.0,
Here All Dwell Free: Stories to Heal the Wounded Feminine,Not Found,Not Found,,,
Ride Pegasus,Anne McCaffrey,,1973.0,26.0,
Highroad to the Stake: A Tale of Witchcraft,Not Found,Not Found,,,
Ghost of Flight 401,John Grant Fuller,,1976.0,3.0,
The World's Most Challenging Puzzles,Charles Barry Townsend,,1988.0,3.0,
Your Body Believes Every Word You Say,Barbara Hoberman Levine,,1991.0,3.0,
The Ultimate Cure: The Healing Energy Within You (Llewellyn's Whole Life Series),Not Found,Not Found,,,
Women Who Run With the Poodles: Myths and Tips for Honoring Your Mood Swings,Not Found,Not Found,,,
The Birth Order Book: Why You Are the Way You Are,Kevin Leman,,1984.0,3.0,
A Cat Under the Mistletoe: An Alice Nestleton Mystery,Not Found,Not Found,,,
The Spiral Dance: A Rebirth of the Ancient Religion of the Great Goddess,Not Found,Not Found,,,
"Drawing Down the Moon: Witches, Druids, Goddess-Worshippers, and Other Pagans in America Today",Not Found,Not Found,,,
Practical Demonkeeping,Christopher Moore,,1992.0,8.0,
In the Meantime : Finding Yourself and the Love You Want,Not Found,Not Found,,,
Plague Dogs,Richard Adams,,1981.0,8.0,
The Once and Future King,T. H. White,,1939.0,81.0,
Doomsday Book,Connie Willis,,1992.0,11.0,
The Horse Goddess (Celtic World of Morgan Llywelyn),Morgan Llywelyn,,1998.0,1.0,
Pride of Lions (Celtic World of Morgan Llywelyn),Morgan Llywelyn,,1997.0,1.0,
Lion of Ireland (Celtic World of Morgan Llywelyn),Morgan Llywelyn,,1996.0,2.0,
"Merlin (The Pendragon Cycle , Book 2)",Not Found,Not Found,,,
Taliesin : Book One of the Pendragon Cycle (Pendragon Cycle),Not Found,Not Found,,,
Smart Vs. Pretty,Valerie Frankel,,2001.0,8.0,
Private Altars,Katherine Mosby,,1995.0,3.0,
372 Le Matin,Philippe Djian,,,0.0,
The Sword of Sagamore,Kara Dalkey,,1989.0,1.0,
Where You Once Belonged,Kent Haruf,,1992.0,5.0,
Rain,Garth Stein,,2008.0,31.0,
The Gashlycrumb Tinies,Edward Gorey,,1981.0,10.0,
Triumph of the Darksword (Darksword Trilogy),Not Found,Not Found,,,
Oasis: Round Their Way,Not Found,Not Found,,,
Soldiers Return Uk,Melvyn Bragg,,2000.0,1.0,
My Idea of Fun,Will Self,,1993.0,7.0,
Doctor Faustus : The Life of the German Composer Adrian Leverkuhn As Told by a Friend,Unknown,,,1.0,
The Handmaid's Tale : A Novel,Maike Surmund,,2019.0,1.0,
Headlong (Bestselling Backlist),Not Found,Not Found,,,
Fangs of Fury (Puffin Adventure Gamebooks),Not Found,Not Found,,,
Solomon Time: An Unlikely Quest in the South Pacific,Not Found,Not Found,,,
Chocolat,Joanne Harris,,1999.0,21.0,
Rancid Aluminum,James Hawes,,1997.0,3.0,
Vanity Fair (Wordsworth Collection),Not Found,Not Found,,,
Confessions of an English Opium Eater,Thomas De Quincey,,1822.0,73.0,
Madame Bovary (Classics S.),Not Found,Not Found,,,
The Long Midnight of Barney Thomson,Douglas Lindsay,,1999.0,2.0,
Harry Potter and the Goblet of Fire (Book 4),Not Found,Not Found,,,
The 10th Kingdom (Hallmark Entertainment Books),Not Found,Not Found,,,
"Redwall (Redwall, Book 1)",Not Found,Not Found,,,
Treasures from the Royal Tombs of Ur,Amy Rebecca Gansell,,2002.0,1.0,
"Thinking Out Loud : On the Personal, the Political, the Public and the Private",Not Found,Not Found,,,
Don't Let's Go to Dogs Tonight: An African Childhood,Not Found,Not Found,,,
Where the Lilies Bloom,Vera Cleaver,,1970.0,10.0,
Amsterdam: Amsterdam and the Hague (Art in Focus),Not Found,Not Found,,,
Paris (Art in Focus),Not Found,Not Found,,,
Sacred,Vikram Chandra,,2006.0,7.0,
ANOTHER ROADSIDE ATTRACTION,Tom Robbins,,1971.0,22.0,
London-Paris,George Orwell,,1933.0,67.0,
London (Art in Focus),Not Found,Not Found,,,
The Time Machine (Bantam Classics),Not Found,Not Found,,,
Faithless: Tales of Transgression,Not Found,Not Found,,,
Answered Prayers,Truman Capote,,1986.0,23.0,
I Can Read With My Eyes Shut (I Can Read It All by Myself Beginner Books),Not Found,Not Found,,,
The Woman Who Walked on Water,Lily Tuck,,1996.0,1.0,
Slaughterhouse Five or the Children's Crusade: A Duty Dance With Death,Not Found,Not Found,,,
The Last Days of Socrates: Euthyphro/Apology/Crito/Phaedo (Penguin Classics),Not Found,Not Found,,,
Alice Im Wunderland: Alice Im Wunderland,"Antonie Zimmermann, Lewis Carroll",,2012.0,11.0,
The Goal: A Process of Ongoing Improvement,Not Found,Not Found,,,
Die GÃ?Â¼nderode,Not Found,Not Found,,,
Der kleine Beziehungsberater.,Till Raether,,2002.0,1.0,
Fabian; die Geschichte eines Moralisten,Erich Kästner,,1975.0,1.0,
Stiller,Max Frisch,,1954.0,38.0,
Benjamin's Crossing : A Novel,Not Found,Not Found,,,
The Hotel New Hampshire,John Irving,,1981.0,10.0,
Drinking the Rain,Alix Kates Shulman,,1995.0,6.0,
Kiss of the Bees: A Novel of Suspense,Not Found,Not Found,,,
The Best of Friends: Joanna Trollope,Not Found,Not Found,,,
After Henry,Joan Didion,,1992.0,4.0,
P Is for Peril,Sue Grafton,,2001.0,7.0,
Finding Mr. Right,Meg Benjamin,,2015.0,2.0,
"Malice Domestic 5 (Malice Domestic , No 5)",Phyllis A. Whitney,,1996.0,4.0,
Manhattan fliegt.,Michael Wallner,,2000.0,1.0,
Looking for a Ship,John McPhee,,1990.0,6.0,
Passing the Flame - A Beadmaker's Guide to Detail and Design,Not Found,Not Found,,,
"Three Cats, Two Dogs: One Journey Through Multiple Pet Loss",Not Found,Not Found,,,
Name of the Rose-Nla,Not Found,Not Found,,,
Beach House,"James Patterson, Peter de Jonge, Peter De Jonge",,2001.0,37.0,
Decider,Kim Soo-Hyun,,2020.0,1.0,
Things a Computer Scientist Rarely Talks About,Donald Knuth,,2001.0,2.0,
Sudden Mischief,Robert B. Parker,,1998.0,2.0,
Under Blood Red Sun,Graham Salisbury,,1994.0,7.0,
Black Beauty (Wordsworth Collection),Anna Sewell,,1998.0,1.0,
Prism Moon,Martine Bates,,2002.0,1.0,
QuiÃ©n se ha llevado mi queso?,Not Found,Not Found,,,
The Smuggler's Treasure (American Girl History Mysteries (Paperback)),Not Found,Not Found,,,
Dark as Day (Cold As Ice),Not Found,Not Found,,,
The Tenth Insight : Holding the Vision,JAMES REDFIELD,,1997.0,1.0,
The Celestine Prophecy (Celestine Prophecy),James Redfield,,1993.0,60.0,
Zen and the Art of Motorcycle Maintenance : An Inquiry into Values,Worth Books,,2017.0,1.0,
In the Belly of the Beast,Jack Henry Abbott,,1981.0,5.0,
"Hyperspace: A Scientific Odyssey Through Parallel Universes, Time Warps, and the Tenth Dimension",Not Found,Not Found,,,
