Title,Author,Subjects,First Publish Year,Edition Count,ISBN
Making Your Home a Haven: Strategies for the Domestically Challenged,Not Found,Not Found,,,
The Westing Game (Now in Speak!),Not Found,Not Found,,,
Interview with the Vampire,Anne Rice,,1976.0,75.0,
The Queen of the Damned (Vampire Chronicles (Paperback)),Not Found,Not Found,,,
Lord God Made Them All,James Herriot,,1981.0,30.0,
"\""O\"" Is for Outlaw",Sue Grafton,,1999.0,7.0,
Organic Chemistry,T. W. Graham Solomons,,1976.0,35.0,
Inorganic Chemistry,"James E. Huheey, Ellen A. Keiter, Richard L. Keiter",,1975.0,6.0,
Kushiel's Avatar (Kushiel's Legacy),Not Found,Not Found,,,
"In-Home Child Care: A Step-By-Step Guide to Quality, Affordable Care",Not Found,Not Found,,,
Essentials of Computational Chemistry : Theories and Models,Not Found,Not Found,,,
Kushiel's Chosen (Kushiel's Legacy),Not Found,Not Found,,,
The Book of Ruth (Oprah's Book Club (Paperback)),Not Found,Not Found,,,
Virginia Woolf: A Biography,Quentin Bell,,1973.0,1.0,
Karpov-Korchnoi: Massacre in Merano (A Batsford chess book),Not Found,Not Found,,,
New Developments in Latvian Gambit,Not Found,Not Found,,,
Epic Battles of the Chessboard,Richard Nevil Coles,,1972.0,1.0,
BATTLE OF THE TITANS,"Stephanie True Peters, Marian Sloane, Marian Sloane",,2024.0,6.0,
"The Ear, the Eye, and the Arm",Nancy Farmer,,1994.0,17.0,
In the Cut,Susanna Moore,,1995.0,2.0,
How to Be Good,Nick Hornby,,2001.0,12.0,
Turbulent Souls: : A Catholic Son's Return To His Jewish Family,Not Found,Not Found,,,
Succulent Wild Woman,Sark,,1997.0,3.0,
The HEALING OF AMERICA,T. R. Reid,,2009.0,5.0,
"The Morning After: Sex, Fear, and Feminism on Campus",Not Found,Not Found,,,
LAST TEMPTATION OF CHRIST (Movie Tie in),Not Found,Not Found,,,
The Informers,Edward R. Tufte,,1983.0,14.0,
Africans in America: AMERICAN (AMERI)ca's Journey through Slavery,Not Found,Not Found,,,
Love in Black and White: The Triumph of Love over Prejudice and Taboo,Not Found,Not Found,,,
The Color Purple,"Alice Walker, Translator Lunine Pierre-Jerome, Alice Walker, Alice Walker",,1976.0,98.0,
Mirror Image,Sandra Brown,,1990.0,21.0,
The Shelter of Each Other: Rebuilding Our Families,Not Found,Not Found,,,
Story of My Life: A Novel,John Strange Winter,,1897.0,1.0,
The First Immortal,James L. Halperin,,1998.0,2.0,
Diaspora,Greg Egan,,1997.0,12.0,
Confucio nel computer: Memoria accidentale del futuro,Not Found,Not Found,,,
And Babies Make Four  (Manhattan Multiples),Not Found,Not Found,,,
Monster Movers,George Ancona,,1983.0,1.0,
The Tycoon's Double Trouble  (Daycare Dads),Susan Meier,,2003.0,1.0,
Legacy of Evil,Ariadne Pritchett,,1973.0,2.0,
"The Spaniard's Woman   Foreign Affairs (Harlequin Presents, 2351)",Not Found,Not Found,,,
"The Greek Tycoon's Ultimatum   The Greek Tycoons (Harlequin Presents, 2353)",Not Found,Not Found,,,
The Firm (Random House Large Print),Not Found,Not Found,,,
Each Time We Love,Shirlee Busbee,,1993.0,2.0,
Murder on the Orient Express,Agatha Christie,,1933.0,196.0,
DEAD MANS FOLLY (Hercule Poirot Mysteries (Paperback)),Not Found,Not Found,,,
Endless Night,Agatha Christie,,1967.0,80.0,
Easy to Kill,Hulbert Footner,,1931.0,8.0,
And Then There Were None,Agatha Christie,,1939.0,182.0,
A Careful Wife,Lindsay Armstrong,,1996.0,3.0,
ABC MURDERS,Agatha Christie,,1936.0,132.0,
The Blind - Date Bride  (The Australians),Not Found,Not Found,,,
The Parisian Playboy   In Love With Her Boss,Not Found,Not Found,,,
Faery Magic,"Mary Jo Putney, Jo Beverley, Barbara Samuel, Karen Harbaugh",,1998.0,1.0,
Tender Is the Storm,Johanna Lindsey,,1985.0,5.0,
The Greatest Discovery,Chris Sorensen,,2003.0,1.0,
Der Fisch lernt fliegen. Unterwegs durch die Jahre.,Erika Pluhar,,2000.0,2.0,
Narcissus and Goldmund,Hermann Hesse,,1971.0,1.0,
Fronteras de Lo Imposible,Iker Jiménez Elizari,,2006.0,1.0,
Sin Noticias De Gurb (Biblioteca breve),Not Found,Not Found,,,
Name Der Rose,"Baumann, Hans D.",,1986.0,1.0,
2001 Spanish and English Idioms/2001 Modismos Espanoles E Ingleses: 2001 Modismos Espanoles E Ingleses,"Eugene Savaiano, Lynn W. Winget",,1975.0,10.0,
Spring Fever!,Kerry Allyne,,1982.0,3.0,
"Mi Gato Angus, El Primer Morreo Y El Pasta",Louise Rennison,,2002.0,1.0,
Pozo y El Pendulo y Otras Historias Espeluzna,Edgar Allan Poe,,1998.0,1.0,
La educaciÃ³n de un hada,Not Found,Not Found,,,
El Circulo Magico,Katherine Neville,,1998.0,2.0,
13 99 Euros,Frédéric Beigbeder,,2002.0,2.0,
"Ocho, El",Roberto Gómez Bolaños,,1995.0,5.0,
Mitologia - Guia Ilustrada de Mitos del Mundo,Not Found,Not Found,,,
El club Dumas (ediciÃ³n en espaÃ±ol),Not Found,Not Found,,,
Falso Movimiento (Gran Angular),Not Found,Not Found,,,
El Ultimo Adios,Mary Higgins Clark,,2001.0,3.0,
LA Tabla De Flandes,Arturo Pérez-Reverte,,1990.0,47.0,
Patience and Sarah,Isabel Miller,,,0.0,
The Notebook,Nicholas Sparks,,1996.0,51.0,
Carnal Innocence,Nora Roberts,,1991.0,17.0,
The Fulfillment,Deepak Chopra,,2003.0,7.0,
"Mattimeo (Redwall, Book 3)",Not Found,Not Found,,,
If I Should Die,"Henderson, M. R.",,1985.0,4.0,
The Wood Wife (Tor Fantasy),Not Found,Not Found,,,
North and South,Elizabeth Cleghorn Gaskell,,1855.0,70.0,
Lost Lady,Jude Deveraux,,1985.0,11.0,
Italy in Mind: An Anthology (Vintage Departures),Not Found,Not Found,,,
White As Snow (Fairy Tales),Unknown,,,1.0,
Overload,Arthur Hailey,,1979.0,33.0,
Ancient Shores,Jack McDevitt,,1996.0,4.0,
Reap the Whirlwind: The Battle of the Rosebud June 1876 (Plainsmen (Paperback)),Not Found,Not Found,,,
Bloodstream,Tess Gerritsen,,1998.0,15.0,
No Comebacks: Collected Short Stories,Not Found,Not Found,,,
Burning Angel (Dave Robicheaux Mysteries (Paperback)),Not Found,Not Found,,,
The List of 7,Mark Frost,,1993.0,5.0,
So Worthy My Love,Kathleen E. Woodiwiss,,1950.0,12.0,
Blue Adept (Apprentice Adept (Paperback)),Not Found,Not Found,,,
Heat and Dust,Ruth Prawer Jhabvala,,1975.0,14.0,
Veronika Decides to Die,Paulo Coelho,,2000.0,3.0,
Manifold Destiny: The One! the Only! Guide to Cooking on Your Car Engine,Not Found,Not Found,,,
Bold Science: Seven Scientists Who Are Changing Our World,Not Found,Not Found,,,
Treehouses: The Art and Craft of Living Out on a Limb,Not Found,Not Found,,,
Home Tree Home: Principles of Treehouse Construction and Other Tall Tales,Not Found,Not Found,,,
The Royal Physician's Visit: A Novel,Not Found,Not Found,,,
Falcon,Dashiell Hammett,,1929.0,88.0,
"The Honor of the Queen (Honor Harrington Series, Book 2)",Not Found,Not Found,,,
The Man on the Balcony: The Story of a Crime (Vintage Crime/Black Lizard),Not Found,Not Found,,,
"The Short Victorious War (Honor Harrington Series, Book 3)",Not Found,Not Found,,,
The Disappearance of Sherlock Holmes,Larry Millett,,2003.0,2.0,
"On Basilisk Station (Honor Harrington Series, Book 1)",Not Found,Not Found,,,
Reaper Man,Terry Pratchett,,1991.0,42.0,
"Between Silk and Cyanide: A Codemaker's War, 1941-1945",Not Found,Not Found,,,
A Beautiful Mind: The Life of Mathematical Genius and Nobel Laureate John Nash,Not Found,Not Found,,,
"GONE FISHIN : Featuring an Original Easy Rawlins Short Story \""Smoke\"" (Easy Rawlins Mysteries (Paperback))",Not Found,Not Found,,,
You Belong To Me,Johanna Lindsey,,1994.0,4.0,
The Threatening Storm: The Case for Invading Iraq,Not Found,Not Found,,,
Reading Lolita in Tehran: A Memoir in Books,Not Found,Not Found,,,
Blue Latitudes : Boldly Going Where Captain Cook Has Gone Before,Not Found,Not Found,,,
Peace Like a River,Leif Enger,,2001.0,15.0,
Embraced by the Light,Betty J. Eadie,,1994.0,4.0,
Cry Wolf,Farley Mowat,,1963.0,41.0,
"The Power of Two (T*Witches, No 1)",Not Found,Not Found,,,
Magic Kingdom for Sale - Sold! (Magic Kingdom of Landover),Not Found,Not Found,,,
The Black Unicorn (Magic Kingdom of Landover Novel),Not Found,Not Found,,,
Wizard at Large (Rookies Series),Not Found,Not Found,,,
Sweet Enemy,Diana Palmer,,2002.0,1.0,
The Time Machine,H. G. Wells,,1895.0,1151.0,
The Invisible Man (Dover Thrift Editions),Not Found,Not Found,,,
Journey to the Center of the Earth,Jules Verne,,2000.0,1.0,
Bradymania!: Everything You Always Wanted to Know - And a Few Things You Probably Didnt (25th Anniversary Edition),Not Found,Not Found,,,
"The Message (Animorphs , No 4)",Not Found,Not Found,,,
"The Invasion (Animorphs, No 1)",Not Found,Not Found,,,
The Yearbook,"Burt Hopkins, John Drummond",,2014.0,56.0,
SCREAM OF THE CAT (PHANTOM VALLEY ) : SCREAM OF THE CAT,Beach,,1992.0,1.0,
EVIL ONE (PHANTOM VALLEY 1) : EVIL ONE (Phantom Valley),Lynn Beach,,1991.0,1.0,
How to Talk So Kids Will Listen and Listen So Kids Will Talk,Adele Faber,,2001.0,3.0,
Farrah : An Unauthorized Biography of Farrah Fawcett-Majors,Not Found,Not Found,,,
Graveyard of the Atlantic: Shipwrecks of the North Carolina Coast,Not Found,Not Found,,,
Han Solo at Stars' End,Unknown,,,1.0,
Splinter of the Mind's Eye,Alan Dean Foster,,1978.0,14.0,
Empire Strikes Back Wars,Donald F. Glut,,1980.0,20.0,
Close Friends,Paula Daly,,2014.0,7.0,
50 Simple Things You Can Do to Save the Earth,"Earthworks Group, The Earth Works Group, Earth Works Group (U.S.), John Javna, Sophie Javna, Jesse Javna",,1989.0,10.0,
"A Hiker's Companion: 12,000 Miles of Trail-Tested Wisdom",Not Found,Not Found,,,
Hiking a Celebration of the Sport and the World's Best Places to Enjoy It (Fodor's sports),Not Found,Not Found,,,
Hungry Hikers Book of Good Cooking,Gretchen McHugh,,1982.0,1.0,
The Cat Who... Companion,Sharon A. Feaster,,1998.0,4.0,
"FOREVER : A Novel of Good and Evil, Love and Hope",Unknown,,,1.0,
The Cat Who Went Up the Creek,Lilian Jackson Braun,,2002.0,3.0,
The Cat Who Sang for the Birds (Cat Who... (Paperback)),Not Found,Not Found,,,
HIGH TIDE FEAR STREET SUPERCHILLER 12,Not Found,Not Found,,,
First Evil (Fear Street Cheerleaders 1) : First Evil,Robert Lawrence Stine,,2012.0,1.0,
BODY SWITCHERS FROM OUTER SPACE: R L STINE'S GHOSTS OF FEAR STREET #14 (GHOSTS OF FEAR STREET),Not Found,Not Found,,,
"The Elf Queen of Shannara (Heritage of Shannara, Book 3)",Terry Brooks,,,1.0,
JUDY GARLAND,Anne Edwards,,1719.0,14.0,
STAR TREK YESTERDAY'S SON (Star Trek: The Original Series),Not Found,Not Found,,,
Perfect Girls (Replica No. 4),Not Found,Not Found,,,
"The Andalite Chronicles (Elfangor's Journey, Alloran's Choice, An Alien Dies) - Animorphs",Not Found,Not Found,,,
"The Visitor (Animorphs, No 2)",Not Found,Not Found,,,
"The Encounter (Animorphs , No 3)",Not Found,Not Found,,,
"Shipwreck (Island, Book 1)",Not Found,Not Found,,,
"Karen's School Trip (Baby-Sitters Little Sister, 24)",Ann M. Martin,,2016.0,1.0,
"Karen's Doll (Baby-Sitters Little Sister, 23)",Ann M. Martin,,2016.0,1.0,
"Karen's Pen Pal (Baby-Sitters Little Sister, 25)",Ann M. Martin,,2016.0,1.0,
The Christie Caper,Carolyn G. Hart,,1991.0,3.0,
Southern Ghost,"Allen Sircy, Chelsie Sircy",,2019.0,16.0,
Montana Sky,Nora Roberts,,1996.0,32.0,
A Thousand Country Roads: An Epilogue to The Bridges of Madison County,Not Found,Not Found,,,
Macromedia Dreamweaver 4: Training from the Source,Not Found,Not Found,,,
All About Passion (Cynster Novels),Not Found,Not Found,,,
Fifth Daughter,Jade Snow Wong,,1950.0,10.0,
To Kiss a Spy (Get Connected Romances),Not Found,Not Found,,,
Lady of Desire,Gaelen Foley,,2003.0,3.0,
The Rogue,Robert E. Howard,,1976.0,113.0,
The Italian,Lynne Graham,,2007.0,11.0,
Scrooge Wore Spurs,Janet Dailey,,2002.0,1.0,
See Jane Score (Avon Romance),Not Found,Not Found,,,
The Ring on Her Finger (Avon Romance),Not Found,Not Found,,,
Reckless Encounter,Rosemary Rogers,,2001.0,2.0,
Finding You/Knowing You : Two Brand-New Novels For One Wonderful Price! (Candellano Family Trilogy),Not Found,Not Found,,,
Impostress (Signet Historical Romance),Not Found,Not Found,,,
Savage Destiny (Savage),Amanda Browning,,1993.0,6.0,
Bride Of Black Douglas (Mira),Elaine Coffman,,2000.0,1.0,
Texas Bride (Leisure Historical Romance),Not Found,Not Found,,,
The Iron Rose,Marsha Canham,,2003.0,2.0,
Love With the Proper Husband (Avon Historical Romance),Not Found,Not Found,,,
On a Wicked Dawn (Cynster Novels),Not Found,Not Found,,,
The Italian's Trophy Mistress  (Mistress To A Millionaire),Not Found,Not Found,,,
Seduced by a Rogue,Connie Mason,,2003.0,2.0,
Naughty Marietta,Nan Ryan,,2003.0,2.0,
The Love Knot,Elizabeth Chadwick,,1999.0,2.0,
Racing Moon,Muriel Jensen,,1991.0,1.0,
Breathing Room (Avon Romance),Not Found,Not Found,,,
Deadly Caress (A Francesca Cahill Romance),Not Found,Not Found,,,
Seduced,Mary Balogh,,2009.0,8.0,
The Very Virile Viking,Sandra Hill,,2003.0,2.0,
Untie My Heart,Judith Ivory,,2002.0,6.0,
Midnight Confessions,Jacquie D'Alessandro,,2007.0,2.0,
Stealing Heaven,Madeline Hunter,,2002.0,3.0,
The Ways of Grace,Linda Francis Lee,,2002.0,1.0,
Reckless Embrace (Leisure Historical Romance),Not Found,Not Found,,,
Kingdom Of Moonlight,Josie Litton,,2002.0,3.0,
"Married By Midnight (Harlequin Historical, No. 622)",Not Found,Not Found,,,
Breaking All the Rules (Avon Light Contemporary Romances),Not Found,Not Found,,,
"River Road (Ross, Joann. Callahan Brothers Trilogy, 2.)",Not Found,Not Found,,,
A Season Of Miracles,Heather Graham,,2001.0,7.0,
"Her Highness, My Wife","Alexander, Victoria",,2002.0,3.0,
Must Be Magic,Jayne Allen,,2022.0,3.0,
The Temptress (The Bride Quest),Claire Delacroix,,2001.0,1.0,
Heart of a Warrior,Johanna Lindsey,,2001.0,7.0,
Savage Moon,Cassie Edwards,,2002.0,2.0,
Texas Homecoming (Night Riders),Not Found,Not Found,,,
The Mating Game (Zebra Contemporary Romance),Not Found,Not Found,,,
Tempt Me Twice (A Kenyon Family Novel),Not Found,Not Found,,,
Romancing Riley,Connie Lane,,2002.0,1.0,
Lady Sophia's Lover,Lisa Kleypas,,2002.0,3.0,
Silent Honor,Unknown,,,1.0,
The Snow Leopard (Penguin Nature Classics),Not Found,Not Found,,,
"Move Your Stuff, Change Your Life : How to Use Feng Shui to Get Love, Money, Respect and Happiness",Not Found,Not Found,,,
Every Day's a Party : Louisiana Recipes For Celebrating With Family And Friends,Not Found,Not Found,,,
"Do Less, Achieve More: Discover the Hidden Power of Giving in",Not Found,Not Found,,,
Success Through a Positive Mental Attitude,"Napoleon Hill, W. Stone",,2007.0,3.0,
Intellectual Capital: The New Wealth of Organizations,Not Found,Not Found,,,
The Book of Questions,Jane Parker Resnick,,2002.0,3.0,
Italian Light Cooking,Elisa Celli,,1987.0,1.0,
"Soulwork: Clearing the Mind, Opening the Heart, and Replenishing the Spirit",Not Found,Not Found,,,
"Nothing in This Book Is True, but It's Exactly How Things Are: The Esoteric Meaning of the Monuments on Mars",Not Found,Not Found,,,
Other People's Skeletons (Rebecca Schwartz Mysteries),Not Found,Not Found,,,
Death and the Joyful Woman,Edith Pargeter,,1961.0,12.0,
No Wind of Blame,Georgette Heyer,,1939.0,33.0,
Iris and Her Friends: A Memoir of Memory and Desire,Not Found,Not Found,,,
The Cat Who Sang for the Birds,Lilian Jackson Braun,,1998.0,5.0,
"Preserving Family Lands, Book I",Stephen J. Small,,1998.0,1.0,
"Martin the Warrior (Redwall, Book 6)",Not Found,Not Found,,,
"Salamandastron (Redwall, Book 5)",Not Found,Not Found,,,
The Cat Who Blew the Whistle,"Lilian Jackson Braun, Lilian Jackson Braun",,1994.0,20.0,
The Lives of Dax (Star Trek: Deep Space Nine),Marco Palmieri,,1999.0,4.0,
"The Pianist: The Extraordinary True Story of One Man's Survival in Warsaw, 1939-1945",Not Found,Not Found,,,
"Dreams of the Raven (Star Trek, No 34)",Not Found,Not Found,,,
Diary of a Mad Bride (Summer Display Opportunity),Not Found,Not Found,,,
"Cry, the Beloved Country (Oprah's Book Club)",Alan Paton,,2003.0,1.0,
Carolina Moon,Nora Roberts,,2000.0,34.0,
Standing in the Rainbow,Fannie Flagg,,2002.0,14.0,
East of Eden (Oprah's Book Club),Not Found,Not Found,,,
Three Fates,Nora Roberts,,2002.0,22.0,
The Courtship Dance of the Borderline,Anthony Walker,,2001.0,1.0,
"The Seeing Stone (The Spiderwick Chronicles, Book 2)","Holly Black, Tony DiTerlizzi",,2000.0,1.0,
Down on Ponce: A Novel,Not Found,Not Found,,,
El Tiempo y la Promesa,"Concha Lopez Narvaez, Antonio Manuel Fabregat",,1990.0,1.0,
The Deptford Trilogy (King Penguin S.),Not Found,Not Found,,,
"Tartuffe, by Moliere","Richard Wilbur, Molière",,1997.0,2.0,
Scorpio Illusion Uk,Robert Ludlum,,1993.0,2.0,
Richtig leben mit Geri Weibel. Neue Folge.,Not Found,Not Found,,,
Richtig leben mit Geri Weibel.,Martin Suter,,2001.0,1.0,
Pay It Forward,Catherine Ryan Hyde,,1999.0,17.0,
Die geheime Geschichte.,Unknown,,1857.0,1.0,
The X-Files: Ground Zero,Kevin J. Anderson,,1995.0,2.0,
Here on Earth (Oprah's Book Club),Not Found,Not Found,,,
Bastard Out of Carolina,"Dorothy Allison, Dorthey Allison, Dorothy Allsion",,1992.0,15.0,
Face the Fire (Three Sisters Island Trilogy),Chris Williams,,,1.0,
The Hobbit: or There and Back Again,Unknown,,,1.0,
Distraction: A Novel,Not Found,Not Found,,,
Alien Taste (Roc Science Fiction),Not Found,Not Found,,,
Islands in the Net,Bruce Sterling,,1989.0,1.0,
Dogbert's Top Secret Management Handbook,Scott Adams,,1997.0,1.0,
Hollywood Speaks: Deafness and the Film Entertainment Industry,Not Found,Not Found,,,
Druids,Terry Brooks,,1991.0,20.0,
The Deed of Paksenarrion,Elizabeth Moon,,1992.0,3.0,
Count Zero (Ace Science Fiction),Not Found,Not Found,,,
A Good Old-Fashioned Future: Stories,Not Found,Not Found,,,
Deaf Culture Our Way,Holcomb,,1995.0,1.0,
A Loss for Words : The Story of Deafness in a Family,Lou Ann Walker,,1987.0,2.0,
Schismatrix Plus: Includes Schismatrix and Selected Stories from Crystal Express,Not Found,Not Found,,,
"When True Night Falls (Coldfire Trilogy, Book 2)",C. S. Friedman,,1994.0,1.0,
The Difference Engine,"William Gibson, Bruce Sterling",,1990.0,28.0,
Holy Fire: A Novel (Bantam Spectra Book),Not Found,Not Found,,,
The Fifth Sacred Thing,Starhawk,,1993.0,2.0,
Stupid White Men ...and Other Sorry Excuses for the State of the Nation!,"Michael Moore, Arte Johnson",,2002.0,1.0,
The Elric Saga PT. II,Not Found,Not Found,,,
No One Noticed the Cat,Anne McCaffrey,,1996.0,9.0,
Great Deaf Americans: The Second Edition,Not Found,Not Found,,,
"The Feel of Silence (Health, Society, and Policy)",Not Found,Not Found,,,
Our Latin Heritage (Our Latin Heritage),Lillian M. Hines,,1966.0,11.0,
The Termination Node,Lois H. Gresh,,1999.0,1.0,
Harry Potter and the Sorcerer's Stone (Book 1),"J. K. Rowling, Mary GrandPré",,2024.0,1.0,
"Silverlight: The Arcana, Book II (Arcana/Morgan Llywelyn, Bk 2)",Not Found,Not Found,,,
War Against War,"Desiderius Erasmus, Lewis Einstein",,2012.0,10.0,
In the Beginning...was the Command Line,Neal Stephenson,,1999.0,10.0,
Guide to Korean Characters: Reading and Writing Hangul and Hanja,Not Found,Not Found,,,
American Deaf Culture: An Anthology,Not Found,Not Found,,,
"Dude, Where's My Country?",Michael Moore,,2003.0,28.0,
Fairy-Faith in Celtic Countries (Library of the Mystic Arts),Not Found,Not Found,,,
Witch,Roald Dahl,,1983.0,107.0,
"SILVERHAND: ARCANA BOOK I (Llywelyn, Morgan. Arcana, Bk. 1.)",Not Found,Not Found,,,
Summon the Keeper,Tanya Huff,,1998.0,1.0,
The 21 Lessons of Merlyn: A Study in Druid Magic and Lore,Not Found,Not Found,,,
"Seekers of the Healing Energy: Reich, Cayce, the Kahunas, and Other Masters of the Vital Force",Not Found,Not Found,,,
Spiritual Cleansing: A Handbook of Psychic Protection,Not Found,Not Found,,,
"From The Two Rivers : The Eye of the World, Book 1 (Wheel of Time (Starscape))",Not Found,Not Found,,,
The Queen's Necklace,Teresa Edgerton,,2001.0,3.0,
L'Education Sentimenntale (World Classics),Not Found,Not Found,,,
We Wish to Inform You That Tomorrow We Will be Killed With Our Families: Stories from Rwanda,PhilipGourevitch,,1999.0,1.0,
La Virevolte,Nancy Huston,,1994.0,4.0,
Meurtres en soutane,Not Found,Not Found,,,
Bee Season: A Novel,Not Found,Not Found,,,
Cherry: A Memoir,Not Found,Not Found,,,
The Simple Art of Murder (Vintage Crime),Not Found,Not Found,,,
Domain,Eric Evans,,2003.0,3.0,
Myth-Nomers and Im-Pervections,Robert Asprin,,1987.0,4.0,
Dave Barry Slept Here: A Sort of History of the United States,Not Found,Not Found,,,
In Praise of Cats,Dorothy Foster,,1975.0,2.0,
Brown Girl in the Ring,Nalo Hopkinson,,1998.0,15.0,
Sons from Afar,Cynthia Voigt,,1987.0,4.0,
"Izzy, Willy-Nilly",Cynthia Voigt,,1986.0,8.0,
Building Blocks,"Emsley, John.",,2001.0,3.0,
Tree by Leaf,Cynthia Voigt,,1988.0,8.0,
Building Blocks (Point),Not Found,Not Found,,,
Jackaroo,Cynthia Voigt,,1985.0,11.0,
A Solitary Blue (Point),Cynthia Voigt,,1999.0,1.0,
Homecoming,Cynthia Voigt,,1981.0,15.0,
Mister Sandman (Harvest Book),Not Found,Not Found,,,
"Hateship, Friendship, Courtship, Loveship, Marriage : Stories",Not Found,Not Found,,,
Too Close to the Falls: A Memoir,Not Found,Not Found,,,
The Picture of Dorian Gray (Penguin Classic),Not Found,Not Found,,,
Phantoms,Norton Juster,,1961.0,64.0,
No Name (World's Classics),Not Found,Not Found,,,
The Bearded Lady,Sharlee Dieguez,,1999.0,1.0,
Cold Comfort Farm,Stella Gibbons,,1932.0,58.0,
Revelation and the Fall of Judea,Maurice A. Williams,,2002.0,1.0,
L'Ami retrouvÃ?Â©,Not Found,Not Found,,,
Lame (Collection Sextant),Not Found,Not Found,,,
The Dante Club : A Novel,Not Found,Not Found,,,
Der Wahnsinn der NormalitÃ?Â¤t.,Not Found,Not Found,,,
Jacob the Baker: Gentle Wisdom For a Complicated World,Not Found,Not Found,,,
Jitterbug Perfume,Tom Robbins,,1984.0,12.0,
Adventures at Sea in the Great Age of Sail: Five Firsthand Narratives,Not Found,Not Found,,,
POSSESSIONS,A. S. Byatt,,1890.0,41.0,
ANGELA'S ASHES,Frank McCourt,,1996.0,35.0,
Who Left That Body in the Rain? (Thoroughly Southern Mysteries),Not Found,Not Found,,,
Violets Are Blue,James Patterson,,2001.0,42.0,
The Dogs of Babel (Today Show Book Club #12),Not Found,Not Found,,,
Tar Baby,Toni Morrison,,1981.0,45.0,
Gone Bamboo,Anthony Bourdain,,1997.0,7.0,
The Etruscan Chimera (Archaeological Mystery),Not Found,Not Found,,,
The Tao of Bada Bing: Words of Wisdom from the Sopranos,Not Found,Not Found,,,
Gestalt Therapy,"Frederick S. Perls, Ralph F. Hefferline Ph.D., Paul Goodman",,1951.0,18.0,
Women Prefer Women,Elula Perrin,,1979.0,1.0,
The Witch's Daughter,Paula Brackston,,2011.0,6.0,
Tomoe Gozen,Jessica Amanda Salmonson,,1981.0,2.0,
Amazons II,Jessica Amanda Salmonson,,1982.0,1.0,
Ancient Blood:  Day of Honor #1 (Star Trek The Next Generation),Diane Carey,,1997.0,2.0,
God Herself: Feminine Roots of Astrology,Not Found,Not Found,,,
Preventive Organic Medicine (Pivot Health Book),Jurt W. Donsbach,,1976.0,1.0,
Contagion,Robin Cook,,1995.0,5.0,
Sudden Death,Nicholas Adams,,1991.0,1.0,
Der Vorleser,Bernhard Schlink,,1995.0,62.0,
Lord Valentine's castle,Robert Silverberg,,1980.0,29.0,
The Tale of the Body Thief (Vampire Chronicles (Paperback)),Not Found,Not Found,,,
"Treaty's Law (Star Trek: Day of Honor, Book 4)",Not Found,Not Found,,,
"Her Klingon Soul (Star Trek Voyager: Day of Honor, Book 3)",Not Found,Not Found,,,
"Armageddon Sky (Star Trek Deep Space Nine: Day of Honor, Book 2)",Not Found,Not Found,,,
"Startide Rising (The Uplift Saga, Book 2)",Not Found,Not Found,,,
Dave Barry's Greatest Hits,Dave Barry,,1988.0,11.0,
The Total Zone (Jordan Myles Mysteries),Not Found,Not Found,,,
GOLDENGIRL,P Lovesey,,1977.0,4.0,
DANGEROUS GAMES,Richard Connell,,1990.0,260.0,
"I, alien : a novel",Not Found,Not Found,,,
Moonscatter,Jo Clayton,,1983.0,2.0,
First Cycle,H. Beam Piper,,1982.0,2.0,
STARCHILD TRILOGY,"Frederik Pohl, Jack Williamson",,1963.0,18.0,
Illegal Aliens (Tsr Books),Not Found,Not Found,,,
Cat House,"Edgar Allan Poe, Charles Baudelaire",,1857.0,16.0,
"The unicorn and other poems, 1935-1955",Anne Morrow Lindbergh,,1956.0,2.0,
Warm Worlds and Otherwise,Not Found,Not Found,,,
The Magick of the Tarot (The Llewellyn Practical Guides),Osborne Phillips,,1990.0,1.0,
Psychic Tarot: Illustrated with the Aquarian Tarot Deck,Not Found,Not Found,,,
Tarot therapy: A guide to the subconscious,Not Found,Not Found,,,
"City of Golden Shadow (Otherland, Volume 1)",Not Found,Not Found,,,
Night Chills,Dean Koontz,,1976.0,25.0,
Pacific Blues,Stephen Smoke,,1995.0,4.0,
Tattoo,Jenny Olsen,,2020.0,134.0,
Cruel &amp; Unusual (Kay Scarpetta Mysteries (Paperback)),"Holly Black, Caitlin Kelly, LitJoy Crate, Holly Black",,2018.0,16.0,
Misery,Stephen King,,1978.0,99.0,
The Eyre Affair: A Novel,Not Found,Not Found,,,
Lord of Light,Roger Zelazny,,1967.0,27.0,
Faerie Tale,Raymond E. Feist,,1988.0,9.0,
Mariette in Ecstasy,Ron Hansen,,1991.0,6.0,
"The Iron Lance (The Celtic Crusades, Book 1)",Not Found,Not Found,,,
The Body Farm,Patricia Cornwell,,1994.0,14.0,
Mortal Fear,Robin Cook,,1988.0,13.0,
Curfew,Basharat Peer,,2008.0,2.0,
The Gold Coast,Nelson De Mille,,1990.0,38.0,
Highland Legacy: Four Generations of Love Are Rooted in Scotland,Not Found,Not Found,,,
"Deep in the Heart: A Novel (Morris, Gilbert. Lone Star Series.)",Not Found,Not Found,,,
Emma's Gift: A Novel,Not Found,Not Found,,,
People of the Owl (First North Americans),Not Found,Not Found,,,
Wind Walker,Cassie Edwards,,2004.0,2.0,
Kansas Brides,Denise Hunter,,2004.0,5.0,
The Tea Rose,Jennifer Donnelly,,2002.0,22.0,
A Burning Obsession (Blaze),Not Found,Not Found,,,
Wanted Woman : Cascades Concealed (Intrigue),Not Found,Not Found,,,
To the Limit (Intimate Moments),Not Found,Not Found,,,
One Eye Open (Intimate Moments),Not Found,Not Found,,,
A Pirate's Love,Johanna Lindsey,,1978.0,9.0,
"Secrets, Vol. 1",BradyGames (Firm),,2005.0,2.0,
A Cry In the Dark : Family Secrets: The Next Generation (Intimate Moments),Not Found,Not Found,,,
Embrace the Twilight,Maggie Shayne,,2014.0,2.0,
Edge of Twilight,Maggie Shayne,,2004.0,3.0,
By the Light of the Moon,Dean Koontz,,2002.0,23.0,
Watchers,Dean Koontz,,1987.0,48.0,
Intensity,Dean Koontz,,1987.0,54.0,
Dark Rivers of the Heart,Dean Koontz,,1993.0,34.0,
CRY THE BELOVED COUNTRY (Scribner Classic),Not Found,Not Found,,,
GOOD EARTH,"Pearl S. Buck, Nick Bertozzi, Ruth Goode, Donald F. Roden, Ernst Simon, Stephen Colbourn",,1931.0,170.0,
The Old Man and the Sea (A Scribner Classic),Not Found,Not Found,,,
Mr. Murder,Dean Koontz,,1993.0,31.0,
The Chronicles of Riddick,Alan Dean Foster,,2004.0,1.0,
The Hours: A Novel,Tony Schumacher,,2014.0,1.0,
Van Helsing,"Ryan, Kevin",,2004.0,1.0,
